Company Name,Hall/Stall,Address / Location,Contact Person,Phone,Mobile,Email,Website,Key Profile / Products Summary
AAREM Engineering (AAREM™),H9/A5,"Plot No. B-4/3, MIDC Mira Road, Near Municipal Water Tank, Mira Road East, Thane - 401107, Maharashtra, India",Rupesh Shah (MD),+91 22 28220094,+91 9820091459,info@aaremengg.com,www.aaremengg.com,"Leading Mumbai manufacturer of packaging machines (22+ years): Shrink Tunnels, L-Sealer Tunnels, Automatic Web Sealer/Sleeve Wrapping, Collators; Stretch-Wrapping: Carton, Pallet, Reel, Coil & Spiral"
AAV Global Dies System & Chemicals Industries Pvt. Ltd.,H15/C3,"Powder Factory, RIICO Industrial Area, Khairthal, Alwar - 301404, Rajasthan, India",Vijay Kumar Mahi (Director),+91 11 45734324,+91 9818104300,zeromoisture.com@gmail.com,-,"Manufacturers of Desiccant Powder, Masterbatches, and other processing additives for plastics industries"
ABBOTT TOOLFAST Pvt Ltd (TOOLFAST),H14G/A7,"Plot 16, Sector 27A, Faridabad - 121002, Haryana, India",Kabir (Sales Manager),+91 129 4042237,+91 9654074927,kabir@toolfastclamps.com,toolfastclamps.com,"World-class manufacturer of Toggle Clamps, Pneumatic & Hydraulic Clamps, Milling & Grinding Accessories; factory ~15 km from New Delhi"
A Creative Edge,H14F/H3,"Gala No.6, Building No.3/B, Shripal Ind. Estate, Golani Naka, Behind Vanu Ind., Palghar - 401208, Maharashtra, India",Ravi Jogi (Proprietor),+91 98190 42856,+91 98190 42856,ravijogi82@gmail.com,www.fliptopwale.com,"Manufacturer of plastic Caps & Closures; specializes in Flip Top Dies & Tools; emphasis on quality, customization, cost-efficiency, lead time, long-term client relationships"
A LA Polystabs Private Limited,H1F/G8,"P-101, Pine Tower, Club Paramount Golf Foreste, Site C, Surajpur, Gautam Buddh Nagar - 201306, Uttar Pradesh, India",Aditya Gupta (Managing Director),+91 120 5105008,+91 9711754205,alapolystabs@gmail.com,-,(Profile limited in text; company appears focused on plastic stabilizers / related additives)
A.T Manufacturing Co,H14F/C11,"24 Laxmi Industrial Estate, Silvassa Road, Vapi - 396230, Dadra And Nagar Haveli, India (Near Fire Office, Daman And Diu)",Anish Vora (Partner),+91 260 27605040,+91 8425863234,visheatmfgco@gmail.com,-,"Established 2000; manufacturer & supplier of wide range of Plastic Caps: Transparent Flip Top Caps, Plastic Flip Top Caps, Colored Flip Top Caps"
A.M. Masterbatch & Compounding Private Limited,H2F/B1,"412-413, Anand Industrial Estate, Opp. Ashok Mill, Naroda Road, Ahmedabad - 382330, Gujarat, India",Parth Thakar (C.E.O.),+91 9879 204374,+91 98795 48332,businesshead@masterheadwala.com,www.ammasterbatch.com,"Part of A.M. Group; 20+ years in masterbatch & compounding additives (BOPP, CPP Film, Flexible/Pharma Packaging, Woven Sack, Lamination Poly Bag, Stretch Film); focus on excellence, growth, trust, integrity"
Abhi Plastic,H5G/M6,"Industrial Park, B/H Sahyog Hotel, NH-48, POR, Dist. Vadodara - 391243, Gujarat, India",Uday Choksi (Partner),+91 99033 55168,+91 9927105525,abhiplastics@hotmail.com,www.abhiplastics.com,"All types of Blown Film Plants (Mono Layer, Multi Layer, Recycle), Tailor-Made Extruder Machines"
Abir Overseas LLC,H15/A15,"606 Rollingbrook Drive, Baytown, Houston - 77521, Texas, United States",Prachi (Marketing Director),+1 856 523,+91 9838933636,marketing@abiroverseas.com,www.abiroverseas.com,Global connector for eco-conscious recycled plastic raw materials; ethical sourcing & high-quality solutions worldwide
Ace Eco Systems,H15/A30,"Compound, Virar East, Behind Novelty Hotel, Palghar - 401303, Maharashtra, India",Amit Patil (Marketing Head),+91 7506223519,+91 7506223519,acecoecosystemmarketing@gmail.com,www.acecosystems.com,Established player; 7500 tons annual capacity PPCP/HDPE/ABS/LLDPE; Post Consumer recycled material; Hot Washing line; in-house lab
ACL (Amba Corporation Limited),H5F/C5,"B401, Western Edge II, Magathane, Borivali East, Mumbai - 400066, Maharashtra, India",Mahesh Shanghavi (Director),+91 22 66889999,+91 9821638254,mahesh@us.aclindia.co,www.aclindia.co,"Since 1955; global leader in Polymers & Plastic Raw Materials; solutions for Automotive, Appliances, Lighting, Engineering; ABS, PP, PMMA, PS, etc."
20 Microns Limited,H5F/C2,"Plot No. 9/10, G.I.D.C. Estate, Waghodia, Vadodara - 391760, Gujarat, India",Krishna Kumar Mishra (President - Product & Business Development),+91 2668 264082,+91 9999913617,mishra@20microns.com,www.20microns.com,"India's largest industrial minerals manufacturer; Calcium Carbonate production/imports; fillers (Talc, Barytes), additives, desiccants, nano minerals for polymers & rubber"
365 Plastium Private Limited,H15/C22,"Survey 1279, Plot No. 50 & 51, Avenew Industrial Park, Cricket Stadium Road, Valvada, Vapi - 396195, Gujarat, India",Prashant Jain (GM),+91 9510271739,-,prashant@365plastium.com,www.365plastium.com,"Modern masterbatch & polymer compound manufacturer; experienced team; innovation, quality, customer-centric solutions"
7Spectrum Advance Materials India Pvt Ltd,H15/C14,"309 UK2, Ecotech-3, Greater Noida - 201308, Uttar Pradesh, India",Rajan Sahu (Director),-,+91 9568749744,7spectrumindia@gmail.com,-,"Leading supplier of polymeric compounds (TPU, TPE, TPV, XLPO, UHM, etc.)"
99 Business Media,H16/A3,"1201, 12th Floor, Gopal Heights, Netaji Subhash Place, Pitampura, New Delhi - 110034, India",D Raj Joshi (CEO),+91 11 41033792,+91 999930025,twtw202@gmail.com,www.99business.com,"Monthly journal ""99 Plastic & Packaging"" covering Plastic, PVC, Packaging, Paper, Corrugation, Signage, Business & Industry"
Acron Sampat Avenue Bicholi Ltd (Polystox International Pvt Ltd),H15/B38,"78 Sampat Avenue, Bicholi Mardana, Indore - 452016, Madhya Pradesh, India",Nilay Rathi (Director),+91 91650 93000,+91 91650 93000,nilay@acroninternational.com,https://polystox.com,"India's first online marketplace for polymers (Polystox); 10,000+ registered users; PVC, HDPE, LDPE, LLDPE, PP, chemicals; one-click purchase"
ACS Engitech Private Limited (ACS),H16/A22,"41-43, Barcelona Industrial Estate, SP Ring Road, Odhav Circle, Ahmedabad - 382415, Gujarat, India",Satish Nagraj (Director),+91 99090 27347,+91 99090 27347,satish@acsengitech.com,www.acsengitech.com,"ISO 9001 certified Siemens Authorized System House; manufactures PLC Panel, MCC Panel, VFD Panel; 60+ employees, 200+ clients, 6500+ work orders executed"
ACT Plast Paints Pvt Ltd,H14F/G3,"No. 3, 3rd Floor, Ranga Nadu Colony, Rajakilpakkam, Chennai - 600073, Tamil Nadu, India",Fayaz Ahmed K (Senior Engineer),+91 8778902030,+91 8778902030,fayazahmed@actplast.in,www.actplast.in,"20+ years serving automotive, consumer, home appliance industries; in-house engineering plastics solutions including molding, painting, printing, plating with quality certifications"
ACMA For Chemicals and Mining,H3F/A4,"70 Joseph Tito Street, El Nozha El Gedida, Cairo - 02, Egypt",Mohamed Ibrahim (CEO),+20 226 227,+20 111 143 3769,logistics.support3@acma-co.com,www.acma-co.com,"Leading Egyptian producer of high-purity Calcium Carbonate & Talc; exports to 80+ countries; 500,000 T/Y capacity with German technology"
Acme Die System Pvt Ltd,H10/A16,"C207, Phase 2, Acme Die System Pvt Ltd., Near CGO Complex, New Delhi - 110006, India",Rajiv Sarna (Manager Sales & Support),+91 11 47718888,+91 9711907029,sales@acmedisys.com,-,Leading manufacturer of PET Preform and Beverage cap molds; multicavity Hot Runner molds up to 96 cavities
Acme Drinktech Solutions LLP,H5G/L10,"C65, Phase II, Industrial Area, Mayapuri, New Delhi - 110064, India",Jasleen Kaur (Head Sales & Marketing),+91 11 40104980,+91 9810631426,sales@acmedrinktec.com,www.acmedrinktec.com,"Leading supplier of molds for single-stage machines (PET, PP, PC, TRITAN); containers and related manufacturing"
Acme Rolltech Private Limited,H12A/E5,"Survey No. 605, Girmatha, Pirana - Miroli Road, Pirana Gam, Ahmedabad - 382425, Gujarat, India",P.K. Acme Rolltech (Director),+91 99 25008330,+91 9999925084,pk@acmerolltech.com,www.acmerolltech.com,"Manufacturer of Ceramic Anilox Rolls, Stack Flexo Sleeves, Narrow-web Flexo, Offset, Specialty Film Coating; refurbishment of existing rolls"
Addon Filmtech Pvt. Ltd.,H14F/H7,"539, Road No. 5, G.I.D.C. Sachin, Surat - 394230, Gujarat, India",Mohit Patel (Director),+91 261 2399904,+91 9924403129,mohit@addonfilmtech.com,-,"Leading Indian manufacturer of PET shrink films, rPET shrink films, PCR content films; recyclable alternatives to PVC; serves food, beverage, pharma, cosmetic industries"
Addwrap Packaging Pvt Ltd (AddWrap),H14F/H6,"36-37-38, Panchratna Industrial Estate, Behind Laxminarayan Petrol Pump, Sarkhej Bavla Road, Changodar, Ahmedabad - 382213, Gujarat, India",Vivek Turakhia (COO),+91 79 74102771,-,vivek.turakhia@addwrap.com,www.addwrap.com,"Specialists in Tarpaulins, Steel wrap, Lumber Wrap, Fire wood covers"
ADEKA India Pvt. Ltd. (ADEKA Add Goodness),H4G/A25,"Unit 206, A Wing, Dynasty Business Park, Andheri-Kurla Road, Vijay Nagar, Andheri East, Mumbai - 400059, Maharashtra, India",Kallash Trivedi (Director),+91 22 40246330,-,info@adekaindia.com,www.adekaindia.com,"Japan-based global additives maker (Halogen Free Flame Retardants, HALS, UV Absorbers, Clarifying Agents, Nucleating Agents, Permanent Antistatic Agents, Plasticizers); non-phthalate solutions"
Aditya Heat Complex,-,"4, New Maninagar Road, Opp Baroda Express Highway, Ahmedabad - 380026, Gujarat, India",Aditya Aahir (Proprietor),+91 9426078939,+91 9909481639,aditya.heatbhai@yahoo.in,-,"20+ years manufacturing: Mica Heater, Casting Heater, Pencil Heater, Nozzle Heater, Power Saving Jacketed Heater, Infrared Heater, Thermocouples, Blower Heater Cover"
ACTS Engineering,H5G/F6,"K-234, Bawana Industrial Estate, Bawana, New Delhi - 110039, Delhi, India",Manish Uppal (Partner),+91 11 41059097,+91 9810745789,actsengineering@hotmail.com,-,Leading manufacturer of Compounding/Recycling & Profile Extrusion Machinery; complete solutions for Twin/Tri/Single Screw Extruders; service for Kneaders & Intermix
"ADC Plastic, JSC",H2F/D1,"Son Dong, Ly Ai, Hanoi - 100000, Vietnam",Daisy Duong (Business Development Representative),+84 24 33658245,+84 349628178,daisy@adcplastic.vn,-,"Established April 2004; Vietnamese masterbatch manufacturer; exports CaCO3 filler & white masterbatch; capacity 460,000 MT/year"
Addenda Chemical India Private Limited (adddiMaster),H15/C45,"1025A, 10th Floor, Tower A2, I-Tech Park, Sector 49, Sohna Road, Gurgaon - 122018, Haryana, India",Allen Zheng (Manager),+91 0124 4974229,+91 9926691920,allen@adddimaster.com,www.adddimaster.com,Subsidiary of Addenda Chemical (USA/China); flame retardant & smoke suppressant manufacturer; warehouse in India; customized formulas
Addinol Lube Oil GmbH (ADDINOL),H4G/D23,"Am Haupttor, Leuna - 06237, Germany",Nina Kristin Thöne,+49 3461 84510,+49 1712787828,nina-kristin.thoene@addinol.de,-,Independent German mineral oil company; high-performance lubricants distributed in 120+ countries
Adiva Polymers Limited,H2F/A7,"E-138 RIICO Industrial Area, Phase 1, Bhiwadi, Alwar - 301019, Rajasthan, India",Sachin Verma (Marketing Head),+91 11 41437460,+91 8858687497,sachin@adivapolymers.com,www.adivapolymers.com,"GRS-certified; sustainable recycled & compounded polymers (PP, LLDPE, ABS, high-performance grades) for automotive, household, electrical sectors; focus on innovation and responsible manufacturing"
Adroit Control Engineers Private Limited,H14G/B5,"Plot No., Sector 69, IMT Faridabad, Faridabad - 121004, Haryana, India",Shikhar Arya (Business Head),+91 129 93111152,-,shikhar.arya@adroitcontrol.com,www.adroitcontrol.com,Well-known manufacturer of Hot Runner Systems & Controllers since 1994; serves global plastics industry from New Delhi base
Adroit Extrusion,H6/E4,"78/A, Akshar Circle, Industrial Park, Near Ambaji, Ghatlodia, Ahmedabad - 382481, Gujarat, India",Urvesh Jethva (Partner),+91 79 26995000,+91 9929543048,info@adroitextrusion.com,www.adroitextrusion.com,"Manufacturer of Multilayer (3/5/7 layer), ABA, Monolayer Blown Film Plants, Granulators, EPC, Online Trim Recycling, Plastic Auxiliaries"
Adsale Exhibition Services Limited,H1GA/D22 & H5G/B2b,"6/F, 321 Java Road, North Point, Hong Kong, China",Binbin Weng (Senior Project Executive) / Zhengsheng Li (Project Manager),+86 80 25163509,-,tizusheng.li@adsale.com.hk,www.adsale.com.hk,Established 1978; pioneer in organizing exhibitions; attracts visitors from 150+ countries/regions; hundreds of thousands of trade visitors annually
Advaitva Dye Chem,H2F/D15,"Plot No. 4785-86, Opp. New Water Tank, GIDC Ankleshwar, Bharuch - 393002, Gujarat, India",Dinesh Patel (Managing Partner),+91 79 2563580,+91 9377717400,info@advaitva.com,www.advaitva.com,"Established 1987; high-quality pigments (Yellow, Orange, Red, Green); Flush Pigments (Pre-dispersed) portfolio for food packaging & other standards"
Advance Molecules,H1F/A8,"Third Floor, 319, DLF Tower, Shivaji Marg, Najafgarh Road, New Delhi - 110015, India",Nishu Bhatnagar (Director),+91 11 45450432,-,accounts@advancemolecules.com,-,(Profile limited; appears to provide advanced chemical/molecular solutions in plastics/additives context)
Advance Moulders Pvt Ltd,H11/J6,"Plot 59, Ecotech 12, Greater Noida West, Near Ek Murti Gol Chakkar, Gautam Buddha Nagar - 201318, Uttar Pradesh, India",Sakshi Dang (Sales Head),+91 120 42223993,-,sales@advanceplasticmachinery.com,www.advanceplasticmachinery.com,Seller of imported Japanese used plastic injection molding machines and auxiliaries
Advance Pigments Pvt Limited (APPL),H15/C27,"Shed No.222, Survey No.78/1, Krishna Industrial Estate, S.P. Ring Road, Odhav, Ahmedabad - 382415, Gujarat, India",Pravin Chaubey (Director),+91 79 22900868,+91 9825854810,info@advancepigments.in,www.advancepigments.in,"India's leading manufacturer & exporter of Color, White, Black, Specialty masterbatches; advanced color solutions for plastic processing industry"
Advance Technology,H14G/G1,"513/1 Anand Parbat, 13, Anand Parbat Ind Area, Near Kundan Restaurant, New Delhi - 110005, India",Vijay Gupta (CEO),+91 11 783690257,-,vijay.gupta68@gmail.com,-,Golden Eagle Plastic Machinery (profile limited; appears related to plastic processing machinery)
Advanced Petrochemical Company (ADVANCED),H14G/6,"P.O. Box 11022, Al Jubail Industrial City 31961, Eastern Province, Saudi Arabia",Fahed Al-Subaie (General Manager Commercial),+966 13 3566006,-,ashesh.christian@advancedpetrochem.com,-,"Closed joint investment company; produces primary petrochemical materials, chemicals, basic & downstream products; focus on renewable energy initiatives"
Aegis Polyfilms Pvt Ltd,H1F/A11,"1218-19, 12th Floor, Astralis, Sector 94, Noida, Gautam Buddha Nagar - 201301, Uttar Pradesh, India",Anil Joshi (AGM - Marketing),+91 120 4301050,+91 9810029593,anil.joshi@aegis.com,-,Emerging manufacturer of sustainable BOPET films; combines advanced European technology with Indian focus; emphasis on recycling & green production
Aerodry Plastics Automation Pvt. Ltd.,H5G/B2,"F-52 & 53, Sector 11, Noida, Gautam Buddha Nagar - 201301, Uttar Pradesh, India",Priyanka Kapoor (Manager - Marketing & Communications),+91 120 4766677,+91 9932006514,priyanka.kapoor@aerodry.com,www.aerodry.com,"Founded 1998; advanced plastics auxiliary equipment, conveying, dosing, extrusion control, mold temperature controllers, chillers, packaging, healthcare, PET recycling solutions"
Aeromec Marketing Co. Pvt. Ltd.,H5G/K5,"Plot No. 6, NH-48, Near Tungarveshwar Phata, Sativali, Vasai East, Palghar - 401208, Maharashtra, India",Hitesh Mistry (Sales & Marketing),+91 9284000300,+91 9828000291,hitesh@aeromec.in,www.aeromec.in,"Online hot laser embossing printing for HDPE pipe, DWC, Cable, Conduit; Online rotary INK printing for PVC pipe; Online socketing machine for PVC pipe"
AG Poly Packs Pvt Ltd,H14F/J5,"Reliance Rd, Lakhan, Bhovapur, Hapur - 201015, Uttar Pradesh, India",Arun Arya (CEO),+91 120 34106,+91 8858812263,agsheet.ea3@gmail.com,-,"30+ years experience in customized packaging solutions for Beauty, Home, Pharma, Food; high-quality products serving 4,500+ clients"
Agarwal Polymers,H1F/B18,"84 A Kirti Nagar, New Delhi - 110015, India",Rohit Agarwal (Co-Owner),+91 11 45011842,+91 9999911219,rohit.aggarwal2111@gmail.com,-,"40+ years expertise; trade, recycle & compound virgin/reprocessed plastic raw materials & masterbatches; consistent quality & sustainable supply"
Agroha Colours Pvt Ltd,H15/C32,"SPL-1C, RIICO Industrial Area, RIICO Chowk, Alwar - 301019, Rajasthan, India",Nikunj Agarwal (CEO),+91 1493 2063790,+91 9810606632,nikunj@agroha.in,www.agroha.in,"Manufacturer of Black Masterbatch, White Masterbatch, Special Effect Masterbatch, Additive Masterbatch"
Plastworld by AIPMA (AIPMA - Plastivision India),-,"Plot No. A-52, Road No. 1, M.I.D.C., Marol, Andheri East, Mumbai - 400093, Maharashtra, India",Shiraz Sequeira (Manager Export Cell),+91 22 67778899,+91 8655736749,shiraz@aipma.net,plastworld.org,"Organizing 2nd edition of Plastworld (export-oriented plastics showcase) March 23-25, 2026, Mumbai; 225+ manufacturer-exporter exhibitors; products for houseware, kitchenware, stationery, packaging etc."
The All India Plastics Manufacturers' Association (AIPMA),H5G/B23,"A-52, AIPMA House, Road No. 1, M.I.D.C., Marol, Andheri East, Mumbai Suburban - 400093, Maharashtra, India",Ms. Uma Gupta (Secretary General),+91 22 67778886,+91 9828050911,office@aipma.net,aipma.net,"Established 1945; India's oldest & largest apex body for plastics industry; recognized by Govt. of India; advocates policies, regulatory uniformity, industry concerns, growth through initiatives & collaborations"
Air Tech Engineers,H5G/E2,"Plot No. 32, Pushkar Industrial Hub, Opp. Machhu Nagar, Near Ramol Police Chowky, Vatva, Ahmedabad - 382445, Gujarat, India",Manishkumar Thakar (Proprietor),+91 79 94891048,+91 9825014048,parth_compressor@yahoo.co.in,www.parthtechcompressor.com,(Profile limited; appears related to air compressors / pneumatic equipment for plastics processing)
AIS Gauging,H46G/33,"934 East Innovation Dr., Terre Haute - 47802, Indiana, United States",Conner Daughety / Sudhir Baddhalkar (Sales & Marketing),+1 812 466 5665,+1 812 466 5665,ashesh.christian@aisgauging.com,www.aisgauging.com,"American global leader in non-contact thickness & control gauging; inline systems for basis weight, coating, moisture, edge scanning & control"
AIC Mould Pvt Ltd,H14G/G11,"A-19 Maruti Industrial Estate, Kathwada Ring Road, Odhav, Near Gurudwara, Ahmedabad - 382415, Gujarat, India",Bipinbhai Vinubhai Baldha (Director),+91 88 849801750,+91 88 49801750,info@aicmould.in,-,"Trusted name in precision mould design & manufacturing; high-performance plastic injection moulds; focus on innovation, quality, customer satisfaction"
AIM Machinitechnik Pvt. Ltd. (AIM),H12A/E7,"Plot No. 2806, Road No. I-2, G.I.D.C. Lodhika Estate, Kalawad Road, Metoda, Rajkot - 360021, Gujarat, India",Jeet Savsani,+91 2827 287069,+91 9924999923,jeetsavsani@aimflex.com,www.aimflex.com,"Established 2003; leading manufacturer/importer/exporter of Rotogravure & Flexographic Printing Machines, Lamination, Slitter Rewinding, Pouch & Bag Making Machines"
Plastivision India (AIPMA - Plastivision),H5G/B23,"A52, Plastivision House, Road No. 1, M.I.D.C., Marol, Andheri East, Mumbai - 400093, Maharashtra, India",Sanjeevi Kothare (Head Marketing),+91 22 67778886,+91 9930355494,sanjeevi@plastivision.org,plastivision.org,"Prestigious UFI-approved event supported by Govt. of India; scheduled Jan 21-25, 2027, Mumbai; world's second-largest plastics exhibition showcasing global innovations"
Akash Poly Plast,H14F/C4,"A-01, Swagat Ind. Park - 3, Kuha, Indore Highway, Ahmedabad - 382433, Gujarat, India",Akash Santoki (MD),+91 97 24722676,+91 9816072990,info@akashpolyplast.com,akashpolyplast.com,"Leading manufacturer & exporter of high-quality sanitary U/PVC valves; accurate dimensions, durability, crack resistance, easy installation, 100% in-house control"
Akrelon (Haryana Leather Chemicals),H3F/C3,"Signature Tower, 1405 B, South City-1, Gurgaon - 122001, Haryana, India",Kumar Saurabh (GM - International Marketing),+91 124 2739235,+91 9812467935,kumar@leatherchem.com,-,"PVC additives division of Haryana Leather Chemicals Ltd (est. 1986); Indo-Italian JV; specialty acrylics for PVC; 4000 MT annual capacity at Jind, Haryana"
Akshar Technology Zone,H14G/D12,"Kalawad Road, Shivam Industrial Zone, Survey No. 188, Rajkot - 360021, Gujarat, India",Pratik Ardeshana (Owner),+91 281 2575155,+91 9428077098,ardeshanatechnology11@gmail.com,https://akshartechnology.com,"Manufacturer of precision moulds for UPVC, CPVC, Agri, SWR, PPR fitting; experience since 2009; range 20mm to 200mm"
Akshay Enterprise,H5G/G2,"Plot 3909, Road No. 'W', Phase-III, Dared G.I.D.C., Jamnagar - 361004, Gujarat, India",Atul Patel (Manager),+91 288 2730797,+91 9900100405,sales@abcrass.com,www.abcrass.com,(Profile limited; appears related to chemical/raw material supply or processing in plastics)
Alfelder Kunststoffwerke Private Limited (Mayer Seals),H4G/G20,"Solus Building, Veda Coworks Solus Building, Office No.1018, Thane - 400607, Maharashtra, India (Germany base)",Parag Agarwal (Business Head),+91 916734795,+91 9616374795,agrawal@meyer-seals.com,meyer-seals.com,"Global leader in induction sealing solutions; high-performance liners for secure, leak-proof German packaging; product safety, freshness, deep industry protection"
All Around Polymer LLP,H2F/F1,"P-14, Street No. 2, Sector-4, Model Economic Township, Dadri Toye, Jhajjar - 124103, Haryana, India",Onkar Rai (Managing Partner),+91 124 4222223,+91 9716016676,onkar@raai.co.in,https://aapi.co.in,"ISO-certified manufacturer of innovative, sustainable tailor-made plastic compounds; in-house R&D; serves automotive, electrical, consumer goods, textiles; global markets with advanced facilities & expertise"
All India Shine Directory,-,"B-9, Gupta Tower, Commercial Complex, Azadpur, Near Aakash Cinema, New Delhi - 110033, India",Manik Raj (Partner),-,+91 9810743280,shineindiaplasticmart@gmail.com,www.shinedirectory.online,"Leading market presence in business directory, magazine publishing & printing services; all-India circulation magazine"
Alliance Petro Plast,H1F/B7,"Plot No. 4, Sector 4, Faridabad - 121004, Haryana, India",Shrey Agarwal,+91 129 2224233,+91 9811105892,alliancechempurchase@gmail.com,alliancepetroplast.com,(Profile limited; appears related to petrochemical/plastic raw materials or processing)
Alliance Polytech Pvt Ltd,H15/C17,"Plot No. PAP S-7, M.I.D.C. Chakan Phase 2, Pune - 410501, Maharashtra, India",Rajesh Bansal (Director),+91 20 22146360,+91 9929224448,rajesh@alliancepolytech.com,www.alliancepolytech.com,Develops & manufactures high-performance masterbatches & compounds; R&D-focused approach for consistency & customized grades; long-term customer partnerships
Alliance Recet Pvt Ltd (Alliance Fibres),H15/C5,"Block No. 214, Village Mota Borasara, Tal Mangrol, Surat - 394110, Gujarat, India",Viral Patel (Export Manager),+91 261 21279007,+91 8469533355,info@alliancefibres.com,-,Established 2006; India's pioneering PET bottle recycling company; committed to sustainable change in textile recycling & packaging industries
Allied Solutions (I) Private Limited,H5G/B25,"313/314, Raikar Chambers, Deonar Village Road, Govandi (East), Opp. Neelkanth Garden, Mumbai Suburban - 400088, Maharashtra, India",Ramesh Parasurasman (Managing Director),+91 22 42221000,+91 9320422108,info@alliedsolutions.com,www.alliedsolutions.com,"Represents AMUT SpA (Italy); leader in extrusion, recycling plants for PET/HDPE design & construction; plastic sorting/washing for PET/HDPE/PP bottles, containers & PE film"
Alok Masterbatches (Alok),H3G/12,"227, Okhla Industrial Estate, Phase-III, New Delhi - 110020, India",Amit Puri (Director),+91 11 41612244,+91 9958828228,info@alokindustries.com,www.alokmasterbatches.com,"India's most trusted masterbatch manufacturer (30+ years); legacy of ""Adding Good""; Government Excellence Awards & National Innovation Awards from Export Promotion Council"
Alp Aeroflex India Pvt Ltd (Aeroflex),H14F/A2,"Plot No. 32, Sector 18, Udyog Vihar, Near Maruti, Gurgaon - 122015, Haryana, India",Hitesh Chhabra (Head - Branding & Communications),+91 124 4731500,+91 9971131407,hitesh@alpaeroflex.com,www.alpaeroflex.com,"Global leader since 1985; EPDM, Silicone, Polymer solutions for Automotive, Railways; cutting-edge R&D; 3000+ experts; advanced insulation, HVAC, ABS/PMMA sheets"
Alpha Factory Automation Co. (Alpha Engineering),H2F/E3,"A-97, 67, Saebitgongwon-ro, Gyeonggi-do - 14348, Gwangmyeong-si, South Korea",Daniel Hwang (General Manager),+82 2 615-5249,+82 10 8651-5249,daniel@polson.co.kr,-,"Leads smart factory industry with advanced plastic material storage, metering, mixing, extrusion, packaging automation, robotic loading, real-time monitoring & data feedback"
Alpha Roto Machines Private Limited,H12A/F9,"Plot No. 22/B, Survey No. 408/2P, Sarkhej Bavla Highway Road, B/H Sarvodaya Hotel, Village Moraiya, Taluka Sanand, Ahmedabad - 382213, Gujarat, India",Renji David (Director),+91 79 250137,+91 9909979806,info@alpharoto.com,www.alpharoto.com,Established 1990; blends experience & innovation in Flexible Packaging & Foil Converting; globally recognized leader with high-quality solutions & service
Alteem Instruments,H12A/E4,"305, Chanakyapuri Road, Sola Bridge, Sola, DJ Toyota, Ahmedabad - 380060, Gujarat, India",Anil Patel (Owner),+91 79 27664222,+91 9662164746,sanjay@alteem.com,-,Established 1995; ISO 9001:2015 certified manufacturer of web-control systems & automation equipment for plastics processing
Aluka Extrusion Industries LLP,H12A/B11,"Near Vodafone House, Corporate Road, Prahladnagar, Ahmedabad - 380015, Gujarat, India",Kunal Parikh (Partner),+91 79 48992145,+91 9825007753,kunal@alukaextrusion.com,-,Manufacturer of all kinds of Aluminium Profiles for Industrial & Architectural use
