Company Name,Hall/Stall,Address / Location,Contact Person,Phone,Mobile,Email,Website,Key Profile / Products Summary
ERMO INDIA (ERMO MOULDS INDIA PVT. LTD.),H14G/A9,"5th Floor, Sai Radhe Complex, 511, Raja Bahadur Motilal Rd, Sangamvadi, Pune - 411001, Maharashtra, India",Mohit Kumar,+91 20 4931,+91 9875854416,mohit.kumar@ermo-tech.com,www.ermo-tech.com,"Established expert in design and manufacture of high-precision injection moulds for plastics industry. Covers wide range of technical applications: Fast cycle Multi-cavities, Multi-Component Moulds, Stack Moulds, IML, In-Mould Assembly technologies (IMA)."
ER-WE-PA GMBH,H4G/C12,"15C, Max-Planck-Straße, Erkrath - 40699, Germany",Florentin Pottmeyer,+49 211 8544,-,florentin.pottmeyer@er-we-pa.de,-,Head of Sales; world market leader in Aseptic Extrusion Coating Solutions. Lifecycle partner for all common coating solutions with excellence.
ESKAY ENGINEERS,H5G/E4,"Om, Sanjay G.E.B. Substation, Sanjay Khatraj Road, Sanjay, Gandhinagar - 382721, Gujarat, India","Swapnil Patel, Technical Consultant",+91 8141 7725515,+91 81417725515,info@eskayindia.com,-,"Manufacturers/exporters since 2006 of Online/Offline Pipe Belling/Socketing, Slotting, Cutting & Chamfering for PVC pipes. External/Internal Threading, Mechanical Footprint, Energy-Efficient, Low Maintenance, Operator-Friendly. Also design/manufacture customized automated solutions for PVC pipe industry."
ESPOIR POLYCOMPOUNDS PRIVATE LIMITED,H15/C26,"Sector 2, Bawana Industrial Area, Bawana, New Delhi - 110039, India","Ashish Aggarwal, Director",-,+91 9357572723,info@espoirplast.com,www.espoirplast.com,"Plastic recycling group offering PCR polymers: rABS (Black), rPC (Grey/Black), rPE Natural flakes, rPP, electronics-TV/LD, rPET customization. Serves automotive, packaging, appliances, coolers industries with large-scale capacity."
ESS BEE HEATERS PRIVATE LIMITED,H16/C14,"Khasra No. 22/6/01, Gali No. 9, Pipal Wali Gali Samay Pur Extn., Indl. Area, New Delhi - 110042, India","Hitrikh Bansal / Sunil Bansal, Director",-,+91 9915655091,sunilbansal151@gmail.com,www.essbeeheaters.com,"Manufacturer of all kinds of Industrial Heaters and Heating Systems: Coil Elements, Industrial Types, Shortwave IR Heater, Ceramic IR Heaters, Import Hot Gun Elements, etc."
ETECH HRS INDIA PRIVATE LIMITED,H14G/B20,"F-5, Near Mata Chowk, Mahipalpur, New Delhi - 110037, India","Alex Massey, Director",+91 11 41552062,+91 9315483114,alex@etechhrs.com,www.etechhrs.com,Single window solution for Hot Runner and Controllers. Experienced team with long-term trust from leading industries in India.
EUROAGUA PLUMTEK PVT LTD,H14F/F7,"Ezhapadi Main Road, Kuppanoor, Salem - 637031, Tamil Nadu, India","Mohan, MD",+91 427 2422946,+91 9715989900,info@euroaquapplumtek.com,www.euroaquapplumtek.com,"Leading manufacturer and exporter of complete range: PPR Pipes & Fittings, Plumbex PTMT Taps, Faucets, Valves, Bath Fittings, PVC Suction, Garden Hoses, Industrial Pipes & Fittings, Food, Textile, Chemical, Pneumatic Piping, etc."
EVAPLAST,H14G/F19,"A-101, Swadhin Indl. Park, Nr. Kothiya Bus Stop, Ahmedabad Indore Highway, Kuka, Ahmedabad - 382433, Gujarat, India","Agnesh Bhalodia, Partner",+91 9825009425,+91 7046009425,info@evaplast.in,-,Manufacturer of Precision Plastic Injection Moulds and Plastic Products.
EVAPOLER ECO COOLING SOLUTIONS,H5G/C29,"G-1-11, VKIA Extn., Badharana, VKIA, Jaipur - 302013, Rajasthan, India","Sumit Agarwal, Partner",+91 141 4016726,+91 9509088836,sumit.agarwal@evapoler.com,www.evapoler.com,"India's leading provider of innovative & sustainable two-stage cooling solutions, air washers, and hybrid air conditioning units for industrial & commercial spaces. Eco-friendly & energy-saving."
"EVER POLYMER CO., LTD.",H1G/C8,"No.538, Sec.1, Minsheng Rd., Nanshan Vil., Guishan Dist., Taoyuan City - 33393, Taiwan","Raymond Tu, Manager",+886 3 3752715,+886 988063987,-,http://www.everlon.com.tw,"Leading TPE material manufacturer delivering innovative, certified solutions for food, medical packaging, industrial, and consumer applications. Global operations with uncompromising quality, safety, and performance compliance."
EVERKEM (FVERK SIA GIOACCHINO MURAT),H4G/A30,"23, Via Giacchino Murat, Milan - 20159, Italy","Alessandro Morandi, Event Manager",+39 02 67076513,+39 3331392541,alessandro.morandi@everkem.it,-,"Specialized in distribution, development, and production of flame retardants and additives for plastic and rubber industries. Products include flame retardants, UV stabilizers, antioxidants, plasticizers, and custom blends."
"EVERPLAST MACHINERY CO., LTD.",H1G/E4,"SP2-28, New India Industrial Complex, Majrakath, Japanese Zone, Alwar - 301705, Rajasthan, India","Alex Kao, Sales Manager",+886 6 2014846,+886 955712937,everstar846@everplast.com.tw,-,"Specializing in pipe, profile, WPC, compounding, and net extrusion lines for over 30 years. Also designs and manufactures extrusion moulds; emphasizes after-care service at all times."
EXCEL HEATERS (EXCEL HEATERS),H16/A23,"644/25, Agarwal Industrial Estate, Somnath Road, Dabhel, Daman - 396210, India","Bharat Shah, Director",+91 260 2244384,+91 9820316881,sales@excelheaters.com,-,"Manufacturer of Induction Heaters (up to 70% power saving), Ceramic Band Heaters, Mica Insulated Band & Strip Heaters, High-Density Cartridge Heaters, Coil & Flexible Nozzle Heaters, Hot Runner Mould Heaters, Silicon Flexible Heaters, Infrared Jackets, Tubular Heaters, Thermocouples. Applications: Plastic processing, injection/blow moulding, packaging, pharma, aerospace, rubber industries."
EXCELLENT TRADERS INDIA,H3F/F9,"101, Shivlok House II, Comm. Complex, Karampura, New Delhi - 110015, India","Ayush Singh, Director",+91 11 45038880,+91 8800883993,excellentradersindia@gmail.com,www.excellentradersindia.com,"Professionally managed import firm importing Paraffin Wax, Polyethylene Wax (PE Wax), Slack Wax, Rubber Process Oil (RPO), and other polymer industry products. Supplies across India; direct container load from Mundra Port available."
EXCELLENT WATER TECHNOLOGY (EXCELLENT WATER TECHNOLOGY),H5G/L7,"211, Circle P Building, Nr. Prahladnagar Cross Road, S.G. Highway, Ahmedabad - 380015, Gujarat, India","Vivek Donga, Technical Director",+91 79 48905328,+91 9725440807,info@excellentwater.com,-,"Leading provider in Gujarat of green, advanced, sustainable, eco-friendly turnkey solutions for raw water, effluent treatment, water recovery, and energy-efficient systems."
EXDS ENGINEERING,H5G/G10,"J-6, Balvant Park Industrial Estate, Process Water Resource, Amraiwadi, Ahmedabad - 380026, Gujarat, India","Samik Parikh, Owner",+91 79 26709885,+91 9974081222,vijayamin2003@yahoo.co.in,-,"Manufacturer of high-quality plastic extrusion dies with precision engineering, innovation, and advanced solutions. Trusted partner ensuring customer satisfaction and enhanced production."
EXILLIQ AUSTRIA GMBH,H4G/C10,"A, Friedrich-Schedel-Straße 1, Nußbach - 4542, Austria","Claudia Zehetner, Marketing Communication",+43 7587 5040,+43 664 884488,claudia.zehetner@exilliq.com,www.exilliq.com,"(Specialized in extrusion tooling/components; specific profile details limited in text, likely precision dies/extrusion systems based on context.)"
EXPAN PLASTIC PACKAGING,H14G/F1,"D-4, Plastic Packaging Complex, Mangolpuri Industrial Area, Phase I, Safal Plant, New Delhi - 110083, India","Sandeep Kumar, Proprietor",+91 11 45751603,+91 9811818999,expanplastics@gmail.com,-,"Manufacturer of PET Moulds, PET Jars & Bottles, PP Caps."
EXTRUSIONTECH,H5G/J4,"Shed No. A / 35/1, 2nd Main Road, Peenya 2nd Stage, Bengaluru Urban - 560058, Karnataka, India","Rajendra Chaphekar, Proprietor",+91 22 26832933,+91 9845020207,extrusiontech@rediffmail.com,-,"Leading manufacturer and exporter of single shaft shredders; successfully installed in major industries (e.g., GEEPEE, Supreme, Oriplast). Also supplies double-shaft shredders and related machinery."
EXTRUTECH,H5G/C7,"215, Satva Icon, Vatral Cross Road, Vastral, Ahmedabad - 382418, Gujarat, India","Haresh Patel, Proprietor",-,+91 9638389900,haresh.patel@doteco.com,-,Automation for Blown Film Plant.
EXXONMOBIL (EXXONMOBIL CHEMICAL),H3G/08,"06-01, 1 Harbourfront Place, Singapore - 098633, Singapore","Jane Y. Chee, Marketing Communications Advisor",+65 9770 0316,-,jane.y.chee@exxonmobil.com,www.exxonmobilchemical.com,"ExxonMobil Signature Polymers; born from belief in people's fuel progress. From automotive to packaging, agriculture; leverages scale to deliver innovations and help partners reach new heights."
EXXONMOBIL LUBRICANTS PVT. LTD.,H3G/08,"G-80, Laxmi Nagar, East Delhi/New Delhi - 110092, New Delhi, India","Bhumika Jain, VP - Client Servicing",+91 11 81300 97106,+91 8130097106,bhumika.jain@affiniqmarketing.com,-,ExxonMobil Lubricants Pvt. Ltd. (related to ExxonMobil's lubricants and polymers business in India).
FADIA ENGINEERS,H12A/G8,"B-1/90/B, Kisan Weigh Bridge, Phase I, GIDC, Vatva, Ahmedabad - 382445, Gujarat, India","Vipul Fadia, Director",+91 79 40084270,+91 9898522354,vipul@fadiaengineers.com,www.fadiaengineers.com,"Manufacturer of Rotogravure Printing Machine and other Post Press Machines for Plastic Packaging & BOPP Wovensack Industries since 2001. Also Solventless Lamination Machine, Slitting Rewinding Machine. Located in Ahmedabad, Gujarat."
FAITH ENGINEERING WORKS,H7A/D17,"G-129, Sector-1, Industrial Area Bawana, New Delhi - 110039, India","Shaji Varghese, Proprietor",+91 11 41670688,+91 9818509609,faithengineering94@gmail.com,-,"Manufacturer of Blow Moulding Machines. Produces machines for making plastic products: Toys, Bats, Jars, Ball, Canes, Gamla, Jugs, Rackets etc."
FAITH INDUSTRIES LIMITED,H5F/A12,"701, Shapath-1, Opp. Rajpath Club, Sarkhej Gandhinagar Highway, Pakwan Cross Road, Ahmedabad - 380015, Gujarat, India","Jayesh Patel, Sr. Manager Business Development",+91 79 26870890,+91 9376955250,marketing@faithind.com,www.faithind.com,45-year-old manufacturer of PVC Stabilizer with in-house R&D and most modern ESBO plant. Innovation centre; presence in over 35 countries.
FALCON PAPERS & PLASTICS,H4G/B06,"Head Office: 1-C, Terminal Way, Avenel - NJ 07001, United States","Sameer Gulati, Head of Operations",+1 732 419 7822,+91 7838380469,info@falconpapers.com,-,"Global sourcing and distribution company specializing in high-quality plastic films, resins, and packaging materials. Strong logistics and trusted partnerships; delivers reliable, cost-effective solutions to converters, packaging companies, and industrial users worldwide."
FAMOUS POLYMERS,H5G/F4,"Plot 40/17, Phase-1, Station Road, GIDC, Vatva, Opp. Shankheshwar Estate-1, Ahmedabad - 382445, Gujarat, India","Falgun Patel, Proprietor",+91 79 46040227,+91 9824011264,info@famouspolymers.com,https://famouspolymers.com,"Founded in 1999 by electronics engineer; manufactures Fully Auto Slitter-Rewinders, Air Bubble Film Plants, PE RP Processing Plants, PIB Masterbatch, Stretch Wrapping Machines. Delivers best quality, advanced technology, and competitive pricing worldwide."
"FANLYPLAS SHANGHAI CO., LTD",H1G/C81,"J508, No.1080, Moyu Road, Anting, Jiading, Shanghai - 201805, China","Jinging Zhang, General Manager",+86 21 69895995,+86 216284728437,export@fanlyplas.com,-,"ISO 9001-certified; blends technology innovation and lean manufacturing to deliver full turnkey projects. Combines equipment, technology, and service; provides full RP support to keep clients competitive."
FANUC INDIA,H11/A18,"41A, Hosur Road, Electronics City, Bengaluru Urban - 560100, Karnataka, India","Manish Sharma, General Manager",+91 80 28520057,+91 9686511997,manish.sharma@fanucindia.com,www.fanucindia.com,"Provides industrial automation solutions: CNC controls, Robots, Vertical Machining Centres, Electric Injection Moulding Machines, Wire EDM. Complete integration of factory automation systems; lifetime support across FA-ROBOT-ROBOMACHINE businesses."
FARREL POMINI (FARREL POMINI CONTINUOUS COMPOUNDING),H4G/G17,"Queensway House, Castleton, Rochdale - OL11 2QQ, United Kingdom","Lori Sheehan, Marketing",+44 1706 647643,-,lsheehan@farrel-pomini.com,farrel-pomini.com,"Global leader in compounding systems: rigid/flexible PVC, flooring compounds, flame retardants, biodegradable plastics, petrochemicals, highly filled/white/black masterbatch, recycled materials. Introduced FCM™ Continuous Mixer in 1963; Compact production from 30 kg/h to 40,000 kg/h with energy/maintenance efficiencies."
FASTRACK POLYFAB PVT LTD,H14G/E5,"E-5, Udyog Deep Comm, Peeragarhi, Peeragarhi Metro Station, New Delhi - 110063, India","R. Chawla, Director Export",+91 11 91909067,+91 9310906702,export@fastrackpolyfab.com,https://fastrackpolyfab.com,"One of the world's largest manufacturers of HDPE & LDPE tarpaulins with annual capacity of 100,000+ Metric Tons. Tarpaulins safeguard valuables for customers across India and worldwide."
FB BALZANELLI S.P.A.,H5G/A26,"26, Via G.B. Poggolesi, Milano - 20124, MI, Italy","Emanuela Balzanelli, Titolare",+39 02 6698312,+39 348 363125,emanuela@fb-balzanelli.it,-,"Founded by Vincenzo Balzanelli; reshaped automatic coiler market for pipes since 1994. Known for innovation, quality, customer care; offers advanced coiler technology, tailored solutions, and most complete range of coilers and palletizing systems."
FEDERAL INDIA TRADING COMPANY,H2F/A6,"No. 49/50, Jain Nagar, Sukhipura Road, Paldi, Ahmedabad - 380007, Gujarat, India","Mehul Javeri, Director",+91 79 26620058,+91 9825018002,mehul.javeri@fitcoindia.com,www.fitcoindia.com,"Offers laboratory testing equipment for Plastic, Polymer, Film, Packaging, Barrier, Fabric, Yarn, Geotextile Industries. Represents brands like PET, Dynisco, Testometric Limited, UK; Carver USA, Wabash MPI USA. Provides free installation, training, operation, calibration, and after-sales services."
FILMOTRIX EQUIPMENTS LLP,H1F/B10,"3, Acme Industrial Park, I.B. Patel Road, Goregaon East, Near Fern Hotel, Mumbai Suburban - 400063, Maharashtra, India","Jayesh M. Shikh, Partner",+91 22 26822721,+91 9821354747,filmotrix@hotmail.com,www.filmotrix.com,"Manufacturer of PLOUGH SHEAR MIXER for Ca/Zn or Mg stearate, also for METAL-Zn stabiliser mixing. Installed 50+ units; VERTICAL MIXER for stabiliser mixing with no cross contamination, almost vertical discharge."
FIMIC SRL,H5G/A36,"44, Via Ospitale, Camisano Vicentino - 35010, Padova, Italy","Giorgia Bortolamei, Marketing",+39 049 9597163,+39 340 9838799,mp@fimic.it,-,"Founded in 1963 as family-run Italian business; global leader in automatic melt filtration for plastics recycling. Offers seven filter models, screw pumps, guillotines; drives innovation and supports circular economy for 600+ clients worldwide."
FINE ORGANIC INDUSTRIES LIMITED,H5F/D3,"Fine House, Anandji Lane, Off M.G. Road, Ghatkopar East, Mumbai Suburban - 400077, Maharashtra, India","Chintan Shah, Manager",+91 22 66050272,+91 7049416475,chintan_shah@fineorganics.com,www.fineorganics.com,"Manufacturer of Plastic and Rubber Additives: Lubricants, Slip Agents, Anti-Static Agents, Wetting & Dispersing Agents, Anti-Fog Aids, Anti-Scratch Improvers, Mould Release Agents, Process Aids, Flow Improvers, Secondary Antioxidants, Foam Stabilizers, Hydrophobic/Hydrophilic Additives, Recycling Additives, Odor Improvers, Soft Feel Additives, Torque Release Agents, Anti-Slip Agents, Antimicrobial Additives."
FINSTER BLACK PVT LTD,H15/C18,"New Era Black Compound, Mogul Lane, Matunga West, Mumbai - 400016, Maharashtra, India","Shubham Gupta, Asst. Manager Sales & Marketing",+91 22 24082595,+91 91778085070,marketing@finsterblack.com,-,"One of India's largest producers of Recovered Carbon Black with over 20,000 MT/year capacity. Contributes to circular economy by turning waste into valuable resources, reducing environmental impact."
FIVE FINGERS EXPORTS (INDIA) PVT LTD,H7A/D2,"468, Vellalar Street, Singanallur, Coimbatore - 641005, Tamil Nadu, India","Arun Kumar K, Director",+91 422 617638,+91 9500617638,ceo@fivefingerexports.com,-,"Manufacturer of PP Woven Bag Conversion machinery: Liner Insertion, Valvemetric Bag Making Machine, Extrusion Lamination, Flexo Printing, Multifilament Yarn Making Machine."
FIVESTAR BRASS INDIA LIMITED,H14F/E9,"3730, GIDC Brass 3, Dared, Jamnagar - 361004, Gujarat, India","Fenil Lakkad, Director - Marketing",+91 288 2730835,+91 9408502102,fenil@fivestarmetal.com,www.fivestarmetal.com,"44-year-old manufacturer of Brass Products: Brass Fittings, Bath Accessories, Brass Inserts, Valves, Faucets, and many more."
FLAMINGO ADDITIVES & COLOURANTS LLP,H3F/E11,"903, Miraki Arena, Sion Trombay Road, Chembur, Mumbai - 400071, Maharashtra, India","Ravi Fotedar, MD",+91 22 25554949,+91 9821011407,ravi@flamingoindia.com,-,"Since 1992, offers 360° solutions for plastics industry: Additives, Compounds & Masterbatches. Global network of principals, scalable supply chain, wide array of facilities."
FLEXAFLEX HOSES INTERNATIONAL,H5G/N1,"408-410, Kailash Chamber, Reid Road, O/S. Panchkuva Gate, Kalupur, Beside Sunrise Restaurant, Ahmedabad - 380001, Gujarat, India",Pooja Shah,+91 79 22146141,+91 7069068458,flexaflexhosess@gmail.com,www.flexaflexhosess.com,"Specializes in high-performance flexible hoses, clamps, connectors for diverse applications: high/low-temperature, chemical, food, air, powder, granules, abrasive media. Consistent quality, reliable & timely delivery, PAN India distribution."
FLEXIBIZ (KIRAN CONSULTANTS PVT. LTD.),H12A/G5,"ATS Bouquet, Tower B, Unit-001, Sector 132, Near Genesis Global School, Gautam Buddha Nagar - 201301, Uttar Pradesh, India","Vaibhav Bansal, Director",+91 120 4317526,+91 9958898317,info@flexibizcorp.com,www.flexibizcorp.com,"ERP solution provider since 1987 for Packaging industry (Flexible Packaging, Woven Sacks, Laminates, Labels, Cartons, Rigid Sacks, Foil Stock, ALU ALU Packaging, and other related segments). Present in more than 9 countries."
FLEXIBLE HOSE INDUSTRIES,H12A/G11,"12th Floor, Chatterjee International Centre, 33A Jawaharlal Nehru Road, Kolkata - 700071, West Bengal, India","Vs Rao, Marketing Executive",+91 33 22263882,+91 9339721606,vsrao@ductsandsahoses.com,www.ductsandsahoses.com,"Manufacturer & exporter of lightweight flexible hoses/ducts for Air/Dust applications: 2/3 Ply Silicone, Neoprene, Santoprene, Spiral PVC Fabric Hoses, Antistatic Hoses, Aviation Ducts, High Temperature Fabric Clip Hoses, Spark Proof Hoses."
FLEXOCHEM VENTURES PVT LTD,H14F/G21,"115 Platinum Industrial Pvt, SIM Mill Compound, Jaimini Park, Vatva Road, Vatva, Ahmedabad - 382445, Gujarat, India","Neel Shah, Marketing Manager",+91 79 26646630,+91 9828262654,marketing@flexochem.com,www.flexochem.com,"Barrier Packaging from 1KGS to 1000KGS: Aluminium Foil Bags, Heat-sealable Shaped Liners, 3D PE Bags, Anti-static/Moisture Barrier Bags, Nylon Liner, ESD Bags, Pallet Covers, OCTABIN Corrugated Box, PE Heavy Duty Pallet Bags, Zipperlock, Masterbatch, Additives."
FLEXON ENGINEERS PVT. LTD.,H12A/G14,"12/A, Mahesh Industrial Estate, Mira Road East, Opposite Silver Park, Thane - 401107, Maharashtra, India","Neil Mehta, Director",+91 98219901034,+91 98219901034,flexonengineers@yahoo.com,www.flexonengineers.com,Manufacturer of Flexographic Printing Presses.
FORTUNE ROTO CONTROL PVT LTD,H12/B11,"D-5 -11, Bhat Brothers Industrial Area, Nagavel Hanuman Road, Rakhial, Amraiwadi, Ahmedabad - 380026, Gujarat, India","Darsh Patel Dharmendra Bhai, Managing Director",+91 79 55880666,+91 9826010934,sales@fortunerotocontrol.com,www.fortunerotocontrol.com,"Manufactures and supplies high-performance air expanding shafts, friction shafts, safety chucks for web handling and winding applications. Focus on precision, durability, reliability across various industries in India and beyond."
FOW MOULD,H1G/A31,"No.328 Xiaoliu Village, Taizhou - 318024, China","Prashant Mistry, India Sales Representative",+91 9819156545,+91 9819165545,prashant.india@fowmould.com,-,Professional in bucket moulds with 15+ years experience; produced about 2500 sets of bucket moulds in various sizes. Provides bucket moulds of every size.
FOXX LIFE SCIENCES PVT LTD,H14F/G5,"65, Rajabrol Medch, Medcity X Road, Medchal Malkajgiri - 501401, Maharashtra, India","Eknath Kulkarni, Managing Director",+91 40 23790222,+91 9859059368,eknath@foxxlifesciences.com,-,State-of-the-art Medical Injection Moulding facility in Hyderabad. Supports all machines from 121 Ton to 450 Ton for medical moulding products.
FRASER ANTI-STATIC TECHNIQUES LTD,H4G/G23,"Scott's Business Park, Bamptom - EX16 9DN, Devon, United Kingdom","Stephen Langford, International Distribution Sales Manager",+44 1398 331114,-,sl@fraser-antistatic.co.uk,https://fraser-antistatic.com,"Provides static control and generation solutions worldwide to OEMs, end users, and machinery distributors. Aims for safer, more efficient operations; supports industries to overcome static electricity challenges and achieve operational excellence."
FREEDOM CHEMTTECH LLP,H5F/D2,"Flat No 2 GH 1, Archana Apartments, Paschim Vihar, New Delhi - 110063, India","Sachin Arora, Director",+91 11 45558000,+91 9999999170,import@freedomgroup.co.in,http://www.freedomgroup.co.in,"Importers, distributors, agents, stockists of global leading chemicals and additives for wide range of manufacturing industries."
FRESCO THIRD POLYMERS PRIVATE LIMITED,H1F/L1,"167, Third Floor, Kapil Vihar, Pitampura, New Delhi - 110034, India","Upendra Jain, Director",+91 11 42133130,+91 9910043020,upenderjain@gmail.com,-,"Manufacturer/Trader of PP, PE, PS, ABS."
FRIENDS POLYPLAST,H14F/C14a,"XI-485A, Sree Krishna Temple Arch, Perumbavoor - 683550, Kerala, India","Lineesh K, Director",+91 9842233114,+91 9539942428,chairmannmouldedfurniture@gmail.com,https://chairmannmouldedfurniture.com,(Manufacturer of moulded furniture/plastic products; specific details limited in text.)
FRIGOSYSTEM COREMAC S.R.L.,H5G/A16,"240, Via J.F. Kennedy, Caronno Pertusella - 21042, VA, Italy","Andrea Gorla, MR",+39 02 966882,+39 348 4868862,marketing@frigosystem.it,-,"Headquartered in Caronno Pertusella (Milan area, Italy); specializes in design and manufacturing of industrial chillers and temperature control systems."
"FUI CHA CO., LTD",H1G/D3,"No.18-2, Wuquan W Road, Nantun Dist., Taichung City - 408022, Taiwan","Christina Huang, Marketing Manager",+886 4 23872389,+886 937853758,fch.christina@fucha.com.tw,https://www.fucha.com.tw,Taiwan's pioneer in LSR (Liquid Silicone Rubber) moulds and solutions. Over 30 years delivering precision LSR automotive silicone components; leading partner for medical and automotive silicone technology worldwide.
"FUJIAN CHANGHONG PRINTING MACHINE CO., LTD",H1G/E01,"A-399A, Shiquan Industrial Project, County Road, Fuqing City, Ningde - 350200, Fujian, China","Lili Yang, Sales Director",+86 591 57767430,+86 591 57782175,admin@chprintingmachine.com,-,"Professional printing machinery manufacturer integrating R&D, manufacturing, sales, and service. Adheres to ""market orientation"" principle; consistently adheres to innovation-driven development for quality and service."
"FUJIAN WELLSON MACHINERY CO., LTD.",H1G/A23,"No. 308, Jiakeng, Binhu S. Road, Taiwanese Investment Zone, Quanzhou - 362121, Fujian, China","Andy Cai, Sales Director",+86 595 27552266,+86 13178046633,andy@wellsonmachinery.com,www.wellsonmachinery.com,"Manufacturer of cast film lines, MDO stretching lines, extrusion coating lamination machines, and perforated film machines for hygiene industry."
"FUJIAN YORK NEW MATERIAL TECHNOLOGY CO., LTD.",H1G/A21,"No. 3001, South Section of Century Avenue, Luoshan Sub-District, Jinjiang - 362200, Quanzhou, Fujian, China","Yuxuan Yan, Marketing",+86 13599303073,+86 13599303073,1165511359@qq.com,-,"Leading one-stop solution for plastic coloring and oxygen absorption. Dedicated to creating high-quality liquid masterbatches, oxygen absorbers, functional materials, and intelligent equipment to empower enterprises and create value."
GM TECHNOCHEM PRIVATE LIMITED,H2F/F11,"1009, Pearls Best Heights-2, Netaji Subhash Place, Pitampura, New Delhi - 110034, India","Vasu Gupta, Director",+91 11 47585058,+91 9910852222,info@gmtechnochem.com,www.gmtechnochem.com,"One of India's leading manufacturers of PVC stabilizers, metallic stearates, lubricants, and polymer additives. Delivers consistent, high-performance solutions meeting modern manufacturing and product innovation needs."
G POLY PLAST INDUSTRIES PVT LTD,H14F/G1,"Plot No. 3318, 3319/1, 3320, Chemical Zone, GIDC, Sarigam, Nr. Aarti Drugs, Valsad - 396155, Gujarat, India","Tosif Sipai, Director",+91 9925043655,+91 9925043655,toosif@gpolyplast.com,www.gpolyplast.com,"Manufacturer of Plastic Sheets / Rolls: PP, PPGL, HDPE, ABS, RPET, APET, GPPS. Caters to Chemical, Pickling Tanks, Pharmaceutical, FMCG, Interior Design industries, etc."
GR PET PREFORMS,H14F/C2,"Gala No.1-2/A-2/B Building, C/1B, Aminajar Indl. Estate, 127/2, Amli, Silvassa, Dadra And Nagar Haveli - 396230, Dadra And Nagar Haveli And Daman And Diu, India","Vipin Tanwani, Partner",+91 260 4012657,+91 9822628061,vipin.grpp@gmail.com,-,"ISO-certified manufacturer, supplier, and exporter of PET Preforms and Caps (plain/flavoured/carbonated). Serves pharma, dairy, packaging, household, mineral water, chemical, confectionery industries, etc."
GABBAR ENGINEERING CO. (GABBAR OIL BAR™),H16/B2,"Plot No. 1903, Phase-III, F-Road, Vatva G.I.D.C. Industrial Estate, Vatva, Ahmedabad - 382445, Gujarat, India",Umesh Panchal,+91 79 25830091,+91 9824602000,umesh@gabbar.com,-,"Manufacturer of bag sewing machines for PP/HDPE/BOPP/Leno Bags & Jumbo/FIBC Bags. Also manufactures Bag Closing Machine with Pedestal Column & Conveyor, Fibc Cutting Machine, and deals in BCS Machine."
GABBAR INDUSTRIES PVT. LTD.,H16/B2,"Plot No. 3606/1, Vatva G.I.D.C. Estate, Phase-1, Opp. Indian Oil Petrol Pump, Ahmedabad - 382445, Gujarat, India","Minesh Panchal, Director",+91 79 25830971,+91 9879309900,sales@gabbarindustries.com,-,Leading manufacturer & exporter of woven sack bag conversion and bag closing machines.
