Company Name,Hall/Stall,Address / Location,Contact Person,Phone,Mobile,Email,Website,Key Profile / Products Summary
"LUNG MENG MACHINERY CO., LTD.",H1G/C10,"No. 20, Kung Kuan Rd., Yung Kang Ind. Area, Tainan City - 710, Taiwan","Mondy Su, Sales Representative",+886 6 2321126,+886 933322462,mondy@lungmeng.com.tw,-,"Established 1976; professional plastics in-line system machinery manufacturer. Developed All In Line Converting System (blown film extruders, printers, recycling unit, bag machines) working together in-line."
MAHAROTO MAHA POLYPLAST PVT LTD (MAHARASHTRA INDUSTRIAL ESTATE),H14G/D3,"15 Sahyog Industrial Estate, Near SK Stone Marble Factory, Mira Bhyandar Road, Mira Road East, Thane - 401107, Maharashtra, India","Rajesh Kumar Sethi, Managing Director",+91 22 28113994,+91 9821050469,techologykumar@gmail.com,-,"Manufacturer & exporter of Customised Rotomoulding Machines. Specialised in CNC Machined Moulds for Rotomoulding, Automobile Parts, Solid Waste Management Products, Pallets, Manhole Chambers, Ice Boxes, Planters, Playground Equipments & Custom Moulding. In-house product design, FEA & trial facilities."
MAHASHASHKTI NARAYANI POLYTEX LLP,H14F/B15,"Paraj Station Road, Kolol More, Bardhaman, Purba Bardhaman - 713144, West Bengal, India","Yash Khater, CEO",+91 7045758581,+91 7045758581,admin@mahashakhtitarpaulins.com,www.mahashakhtitarpaulins.com,"Leading manufacturer & exporter of HDPE/PE tarpaulins, shade nets, laminated rolls based in West Bengal, India."
MAHAVEER CHEMICALS,H15/C9,"4-1-2/1, Eden Bagh, Hyderabad - 500001, Telangana, India","Sachin Khivsara, Proprietor",+91 40 24753065,+91 9849050654,mahaveerchemi@gmail.com,-,"Trading company representing MNCs & large domestic companies in Pigments, Dyes, Plastic Additives. Importers of Acrylic Stabilizers; presence PAN India."
MAHAVIR CHEMPRO LIMITED,H2F/A11,"187, BSF Colony, Jalandhar - 144008, Punjab, India","Vishnu Gupta, Deputy Managing Director",+91 181 50800055,+91 8288389645,vishnu@mcp.in,www.mahavirgroup.com,"Expertise in PVC, CPE processing, Lubricants, Impact Modifiers, PE waxes, Calcium, representing Baerlocher, Fine Organics, Shandong Keli, Epigral, Yubang & more. Warehouses in Punjab, Gujarat & Uttar Pradesh."
MACHINECRAFT TECHNOLOGIES,H9/B2,"505 Palm Springs, Link Road, Malad West, Mumbai Suburban - 400064, Maharashtra, India","Rushabh Doshi, Partner",+91 22 28817785,+91 9831132903,rushabh@machinecraft.org,www.machinecraft.org,"Manufacturer of Thermoforming Machines, Automotive, Sanitary, Thermoplastic Sheets (ABS, HDPE, ASA), Packaging, Automotive Interiors Machinery, CNC Routers, Film Lamination, Trimming."
MAC PRINTING SOLUTIONS,H12A/E16,"D-36, DSIIDC Packaging Complex, Kirti Nagar, New Delhi - 110015, India","Rajesh Gandhi, Director",-,+91 9911172408,rajeshgandhi11@gmail.com,www.macprintingsolutions.com,"Known for quality printing machines/components for various industries: Plastic Parts, Automobile, Toys, Electronics, Home Appliances, Tyre-Tubes, Footwear/Components. Customized printing machines."
MACHINE WORLD,H7A/E1,"79B, Matheshwartala Road, Tangra, China Town, Chinese Kali Mandir, Kolkata - 700015, West Bengal, India","Chandan Das, Proprietor",+91 33 798689856,-,chandan@emachineworld.com,www.emachineworld.com,Manufactures biodegradable & compostable Carry Bag Making Machines. Deals in granulating machines & trading with foreign companies.
LORANDI SILOS INDIA PVT LTD,H5G/A17,"SF No 173/345, Pillaiyampalayam, Kariyapalayam, Annur, Coimbatore - 641653, Tamil Nadu, India","Balachandar Jagannathan, Director",+91 422 7406668,+91 9443373641,info@lorandisilos.in,www.lorandisilos.in,"Pioneer manufacturer of textile silos, blending (homogenization) silos, conveying solutions (blowers, screw conveyors), big-bag unloading stations for PET, engineering plastics, food additives, etc."
LORD KRISHNA PAD PRINTING,H12A/G2,"Plot No-169/170, Sector-37, Near Fareportal Customer Care, Gurgaon - 122001, Haryana, India","Kanwar Singh Yadav, Manager",+91 124 4000109,+91 9352206137,lordkrishnapadprinting@gmail.com,-,"Operations since 2000; one of the foremost manufacturers, wholesalers & exporters of high-quality Pad Printing Machines, Cliché Plates, Pads, Printing Solvents, Printing Inks, Printing Machine Rollers & more."
LRI (LR INDUSTRIES LLP),H14F/G2,"South City Amnol Park, Howrah - 711115, West Bengal, India","Rajesh Bidl, Partner",+91 33 25571688,+91 9830993578,lrillp78@gmail.com,-,"BIS License holder of IS: 2508-2024 certified; offering multilayer quality blown film in all colours. Focus on customer satisfaction, service, commitment, creativity & support."
MAINOR ROHRSYSTEME GMBH & CO. KG,H4G/D04,"1, Maincor, Knetzgau - 97478, Bavaria, Germany","Tobias Kuhn, Managing Director",+49 9521 9516,-,tobias.kuhn@maincor.de,https://maincor.de/en,"Quality Made in Germany; manufactures heating pipes & sanitary systems for automotive, industrial, home appliances. Innovative extrusion technology & custom extrusion lines for plastic pipes."
MAK SOHAR CHEMICAL INDUSTRIES (FZCO) LLC,H4G/D06,"Sohar Freezone, Chemical Industries, Fujairah - 322, North Oman","Shamon Dharam, Project Manager",+968 871967929,-,shamon@mak-sohar.com,www.mak-sohar.com,"High-quality polymer compounds, masterbatches & specialized granules. Focus on reliability, technical expertise & scalable production; supports regional demanding applications."
MAKE3D.IN,H5G/K6,"36/A, Nilkanth Industry-1, Near Hari Om Mill, Ved Road, Katargam, Surat - 395004, Gujarat, India","Tejas Diyora, BDM",+91 261 8866371,+91 8866701006,info@make3d.in,www.make3d.in,"Innovative Indian company specializing in industrial 3D printing & printing services. Offers advanced FDM printers for automotive, design industries with high-performance solutions."
MAKERS POLYFILMS PVT LTD,H14F/B18,"Sr No 1509, Bh. Shriniwas GM Tech Ltd, Opp. Geb Substation, Kundi Dungri, Valsad - 396385, Gujarat, India","Nishant Panwar, Sales & Marketing",+91 9878000669,+91 9878000669,nishant@shriklabels.com,www.shrinklabels.com,"20+ decades experience; offering Heat Transfer Labels, Shrink Sleeves, Wrap Around Labels, In-Mould Labels printed using High End Gravure & Flexography machines to esteemed clients across segments."
M J PIGMENT & ADDITIVES PVT LTD,H3F/E6a,"H-425A, RIICO Industrial Area, Khushkhera, TMT Chowk, Khushkhera - 301707, Rajasthan, India","Jaswant Yadav, Director",+91 724683330,+91 7246833388,sales@mjpa.co.in,www.mjpa.co.in,"Established 2017; leading manufacturer of Plastic Masterbatch & trusted trader of wide range: Pigments, Dyes, Polymers, Calcium fillers, Talc, Moisture absorbers, Titanium dioxide, Carbon black, Waxes, Additives."
M PLAST (ROTATIONAL MOULDING - ROTOMOULDING),H11/F3,"A-15, Sector 60, Noida - 201301, Uttar Pradesh, India","Mohit Shukla, Director",+91 120 2581087,+91 9999909224,ms@mplast.in,www.mplast.in,"One-stop solution for rotational moulding. 40+ years experience; clients in 50+ countries. Offers CNC machined, hand fabricated steel & aluminium moulds; also Rock 'n' Roll Oven machines."
M S COOL ENGINEERS,H16/A27,"224/1, Abdul Fazal Enclave Part II, Okhla, Bilal Masjid, New Delhi - 110025, India","Asif Saifi, Owner",+91 11 41314125,+91 9811842556,info@mscoolengineers.in,www.mscoolengineers.in,(Manufacturer of cooling systems/engineering components for plastics; specific details limited in text.)
M G SAFE INDIA,H14F/B23,"A-18, RIICO Industrial Area, Khushkhera, Near Honda Plant, Alwar - 301707, Rajasthan, India","Sanjay Jain, Proprietor",+91 93100 80314,+91 9821804635,jain.rishabh.222001@gmail.com,www.mlon.com,"Engineering Polymer House based in Rajasthan; supplies stock shapes & machined components in engineering plastics like Nylon, heavy industries, machinery, defense, automobile, automation & more."
MANJUSHREE TECHNOPACK LIMITED,H14G/E6,"46,47 MBH Tech Park, 2nd Floor, Hosur Road, Electronic City Phase II, Bengaluru Urban - 560100, Karnataka, India","Mayank Chidri, Senior Manager - Strategy & Marketing",+91 80 4836 9416,+91 9918949316,mayank.chidri@manjushreeindia.com,-,"India's largest professionally managed rigid plastic packaging manufacturer. Drives innovation & sustainability across FMCG, pharmaceuticals, personal care, beverages, paints & more. 30+ factories serving leading Indian & global brands for over 45 years."
MANOJ TRADING COMPANY,H2F/D12,"Plot No.22, Sector No.11, GIDC, Gandhidham, Near 37020 Steel, Kachchh - 370201, Gujarat, India","Amruj Agrawal, Sales",+91 2836 256165,+91 9829525165,amrujagrawal788@gmail.com,-,"Reliable supplier of high-quality plastic raw materials including PP, PE, PVC & other polymers. Serves diverse industries with consistent supply, competitive pricing, versatile & cost-effective solutions."
MANUFACTURING SIMPLIFIED,H14F/D17a,"Ganges Residency, Flat No C101, 36 West Bengal Circular Road, TC Road, Bank More, Asansol - 713303, West Bengal, India","Ankit Pansari, Founder",+91 98360 91963,+91 9836082006,info@manufacturingsimplified.com,www.manufacturingsimplified.com,(Manufacturer/simplifier of industrial processes & solutions; specific plastics context limited in text.)
MARCHANTE SA,H4G/F17,"44, Avenue Du Tir Fédéral, Ecublens - 1024, Switzerland","Ghislain Rosset, Sales Manager",+33 3 8365 5317,+33 6 65654329,g.rosset@marchante.fr,-,"Designs & supplies high-performance film-orientation production lines (MDO) for technical industries: Current Collector, Capacitor, Battery Separators for EVs; specialty packaging films (PETG, BOPA, BOPP, BOPET, BOPS) & mono-material films."
MAINOR ROHRSYSTEME GMBH & CO. KG,H4G/D04,"1, Maincor, Knetzgau - 97478, Bavaria, Germany","Tobias Kuhn, Managing Director",+49 9521 9516,-,tobias.kuhn@maincor.de,https://maincor.de/en,"Quality Made in Germany; manufactures heating pipes & sanitary systems for automotive, industrial, home appliances. Innovative extrusion technology & custom extrusion lines for plastic pipes."
MAK SOHAR CHEMICAL INDUSTRIES (FZCO) LLC,H4G/D06,"Sohar Freezone, Chemical Industries, Fujairah - 322, North Oman","Shamon Dharam, Project Manager",+968 871967929,-,shamon@mak-sohar.com,www.mak-sohar.com,"High-quality polymer compounds, masterbatches & specialized granules. Focus on reliability, technical expertise & scalable production; supports regional demanding applications."
MAKE3D.IN,H5G/K6,"36/A, Nilkanth Industry-1, Near Hari Om Mill, Ved Road, Katargam, Surat - 395004, Gujarat, India","Tejas Diyora, BDM",+91 261 8866371,+91 8866701006,info@make3d.in,www.make3d.in,"Innovative Indian company specializing in industrial 3D printing & printing services. Offers advanced FDM printers for automotive, design industries with high-performance solutions."
MAKERS POLYFILMS PVT LTD,H14F/B18,"Sr No 1509, Bh. Shriniwas GM Tech Ltd, Opp. Geb Substation, Kundi Dungri, Valsad - 396385, Gujarat, India","Nishant Panwar, Sales & Marketing",+91 9878000669,+91 9878000669,nishant@shriklabels.com,www.shrinklabels.com,"20+ decades experience; offering Heat Transfer Labels, Shrink Sleeves, Wrap Around Labels, In-Mould Labels printed using High End Gravure & Flexography machines to esteemed clients across segments."
Company Name,Hall/Stall,Address / Location,Contact Person,Phone,Mobile,Email,Website,Key Profile / Products Summary
MATRIX MATERIAL SCIENCES,H1F/E4,"1/26, Site 4 Industrial Area, Sahibabad, Ghaziabad - 201010, Uttar Pradesh, India","Ammit Jain, C.E.O.",+91 120 4370023,+91 9311466773,triconspecialties@gmail.com,www.matrixmaterials.in,"(Specialty materials & additives for plastics; specific details limited in text, likely masterbatches/resins/compounds based on name & context.)"
MAURYA INDUSTRIES,H14F/B5,"Gala No.1, Amarnath Industrial Estate, Tungreshwar Complex, Sativali, Vasai East, Palghar - 401208, Maharashtra, India","Jilajet, Owner",+91 9930482693,+91 9930482693,mauryaindustries1978@gmail.com,-,"Diversified manufacturer delivering engineering products in plastics with vision of innovation. Manufactures Scrap Grinder Machines, Dana Cutters, Blade Sharpening, Scrap & Colour Mixers."
MAXRAY CORPORATION,H2F/F4,"4279, Road No. 5, Jai Mata Market, Tri Nagar, New Delhi - 110035, India","Sandeep Agarwal, Proprietor",+91 11 4107006,+91 9310003755,-,www.maxrayin.in,"50+ years in plastics; excels in quick delivery of genuine products PAN India. Import & export of Methyl Methacrylate, Stearic Acid, PE Wax, Processing Aids, Impact Modifiers. Authorised distributors for Indofil, Yunnan Tin."
MAXWELL CONTROL,H12/C5,"13, Dhara Control, Opp. Le Modular Pvt Ltd, Near Narmada Canal, Sanjeli - Khatraj Road, Ta. Kalol, Dist. Gandhinagar, Ahmedabad - 382721, Gujarat, India","Manthan Shah, Partner",-,+91 9428481582,manthan@maxwellcontrol.com,www.maxwellcontrol.com,Manufacturer of Auto Web Tension Control Systems.
MCB MOULD TECHNOLOGY,H14G/A12,"252/2, NSC Bose Road, Netaji Nagar, Puja Garden Apartment, Kolkata - 700040, India","Mithun Mondal, Senior Sales Manager",+91 33 40637353,+91 7047088427,mithun@mcbmouldtechnology.com,-,"Pioneer in injection mould making industry since 2002. Manufacturing unit in Taizhou, China."
MAHAROTO MAHA POLYPLAST PVT LTD (MAHARASHTRA INDUSTRIAL ESTATE),H14G/D3,"15 Sahyog Industrial Estate, Near SK Stone Marble Factory, Mira Bhyandar Road, Mira Road East, Thane - 401107, Maharashtra, India","Rajesh Kumar Sethi, Managing Director",+91 22 28113994,+91 9821050469,techologykumar@gmail.com,-,"Manufacturer & exporter of Customised Rotomoulding Machines. Specialised in CNC Machined Moulds for Rotomoulding, Automobile Parts, Solid Waste Management Products, Pallets, Manhole Chambers, Ice Boxes, Planters, Playground Equipments & Custom Moulding. In-house product design, FEA & trial facilities."
MAHASHASHKTI NARAYANI POLYTEX LLP,H14F/B15,"Paraj Station Road, Kolol More, Bardhaman, Purba Bardhaman - 713144, West Bengal, India","Yash Khater, CEO",+91 7045758581,+91 7045758581,admin@mahashakhtitarpaulins.com,www.mahashakhtitarpaulins.com,"Leading manufacturer & exporter of HDPE/PE tarpaulins, shade nets, laminated rolls based in West Bengal, India."
MAHAVEER CHEMICALS,H15/C9,"4-1-2/1, Eden Bagh, Hyderabad - 500001, Telangana, India","Sachin Khivsara, Proprietor",+91 40 24753065,+91 9849050654,mahaveerchemi@gmail.com,-,"Trading company representing MNCs & large domestic companies in Pigments, Dyes, Plastic Additives. Importers of Acrylic Stabilizers; presence PAN India."
MAHAVIR CHEMPRO LIMITED,H2F/A11,"187, BSF Colony, Jalandhar - 144008, Punjab, India","Vishnu Gupta, Deputy Managing Director",+91 181 50800055,+91 8288389645,vishnu@mcp.in,www.mahavirgroup.com,"Expertise in PVC, CPE processing, Lubricants, Impact Modifiers, PE waxes, Calcium, representing Baerlocher, Fine Organics, Shandong Keli, Epigral, Yubang & more. Warehouses in Punjab, Gujarat & Uttar Pradesh."
MEAF MACHINES B.V.,H4G/G31,"Industrieweg 10, Yerseke - 4401 LB, Netherlands","Ardjan Houtemaker, Technical Director",+31 113 571495,+31 6 16216399,a.houtemaker@meaf.com,-,75+ years manufacturing equipment for plastics industry. Specialist in compact sheet extrusion lines for wide variety of applications.
MECHATRONICA S.C.,H4G/A32,"7, Rayko Daskalov Str., Gabrovo - 5300, Bulgaria","Rahul Kumar, Administrative Officer",+359 66 8138568,-,rk9207670@gmail.com,-,"Designs & builds innovative automated lines: tube making, header-capping & flexible packaging machinery—customised for cosmetics, pharmaceutical & food industries; high-speed solutions."
MEECH SHAVOTEC (MEECH INTERNATIONAL),H4G/F20,"29/2, Old Mumbai Pune Road, Kharadi, Pune - 411014, Maharashtra, India","Ravi Shinde, Sales Manager",+91 20 3382911,+91 9322105500,ravi@shavotec.in,https://www.meech.com,Offers tailored Static Control & Web Cleaning technology to remove static charges & contamination in plastics industry. Global offices; creates innovative solutions designed by industry experts.
MEET ENGINEERING,H5G/C1B,"C-1/527, New GIDC, Gundlav, Valsad - 396035, Gujarat, India","Jayeshbhai Patel, Proprietor",+91 2632 237466,+91 9824461529,meet.engg@yahoo.com,-,"22+ successful years in manufacturing & exporting Plastic Recycling Machineries: Shredders, Granulators (3000 kg/hr), Mixers (Conical, Vertical, Stirrer), Knife Sharpener, Blowers, Dust Separator, Sylo, All Type Granulator Blades, Screen, Rotor."
MEET ENGINEERING WORKS,H5G/C1a,"Shed No. 525/3, New GIDC, Gundlav, Valsad - 396035, Gujarat, India","Minaben Patel, Proprietor",+91 2632 240011,+91 7561561529,info@meetengineering.in,-,"Sister concern of MEET Engineering; manufacturers of Plastic Machineries: Granulators, Mixers (Conical, Vertical, Stirrer), Vibro Screen, Inline Sheet Feeder, Granulator Blades, Dust Separator, All Type Granulator-Agglomerator, Screen, Rotor & Accessories."
MEET TECHOLOGY PRIVATE LIMITED,H14G/A8,"Plot No. 4603, GIDC Phase-IV, Vatva, Behind Indo German Tool Room, Ahmedabad - 382445, Gujarat, India","Swapanil Jagannath Shewale, Director",+91 79 49191418,+91 7020886888,swapanil@meetstech.com,www.meetstech.com,Preferred supplier of PET preform moulds in India. One of few manufacturers with hot runner systems; in-house facilities for design & manufacture.
MEGATRONIK INDUSTRIES PRIVATE LIMITED,H5G/C25a,"Shed No. 68, Radhe Krishna Industrial Estate, Near Krishna Silver Ind. Estate, Kathwada GIDC Road, Ahmedabad - 382430, Gujarat, India","Vaishnav, MD",+91 96 62711777,+91 9023266700,sales@zaffyof.com,https://zaffyof.com,(Manufacturer of engineering plastics/components; specific details limited in text.)
MAGNUS POLYMERS PVT LTD,H4F/B7,"M 217, Sector 2, Bawana Industrial Area, New Delhi - 110039, India","Rahul Batra, Director",+91 11 49054196,+91 9999224673,rahul@magnusrecycling.com,www.magnusrecycling.com,"Recycle Polymer compounding company providing 100% replacement of virgin compounds in Electrical, Automotive, Electronic goods (PP, ABS, PA66, PA6, HIPS, Commodity & Engineering Polymers)."
MANJUSHREE TECHNOPACK LIMITED,H14G/E6,"46,47 MBH Tech Park, 2nd Floor, Hosur Road, Electronic City Phase II, Bengaluru Urban - 560100, Karnataka, India","Mayank Chidri, Senior Manager - Strategy & Marketing",+91 80 4836 9416,+91 9918949316,mayank.chidri@manjushreeindia.com,-,"India's largest professionally managed rigid plastic packaging manufacturer. Drives innovation & sustainability across FMCG, pharmaceuticals, personal care, beverages, paints & more. 30+ factories serving leading Indian & global brands for over 45 years."
MANOJ TRADING COMPANY,H2F/D12,"Plot No.22, Sector No.11, GIDC, Gandhidham, Near 37020 Steel, Kachchh - 370201, Gujarat, India","Amruj Agrawal, Sales",+91 2836 256165,+91 9829525165,amrujagrawal788@gmail.com,-,"Reliable supplier of high-quality plastic raw materials including PP, PE, PVC & other polymers. Serves diverse industries with consistent supply, competitive pricing, versatile & cost-effective solutions."
MANUFACTURING SIMPLIFIED,H14F/D17a,"Ganges Residency, Flat No C101, 36 West Bengal Circular Road, TC Road, Bank More, Asansol - 713303, West Bengal, India","Ankit Pansari, Founder",+91 98360 91963,+91 9836082006,info@manufacturingsimplified.com,www.manufacturingsimplified.com,(Manufacturer/simplifier of industrial processes & solutions; specific plastics context limited in text.)
MEHAK POLY PLAST,H1F/B22,"F-203, Sec-1, DSIDC Industrial Area, Bawana, New Delhi - 110039, India","Praveen Aggarwal, Owner",+91 11 401925,+91 9811250175,mehakpolyplast@gmail.com,-,"Based in Delhi; supplies prime plastic raw materials with focus on high-performance compounding of ABS & PP polymers. Expertise in creating precise, custom colored accurately granules (dana) to meet unique industrial specifications."
MEHER INTERNATIONAL,H2F/B12,"8A World Trade Center, Ring Road, Near Udna Darwaja, Surat - 395002, Gujarat, India","Milan Patel, Business Development Manager",+91 261 2223596,-,milan@meherinternational.in,-,Established to bridge gap in polymer business between expectation & delivery. Exceeding customer expectations & satisfying suppliers; key player in polymer segment.
MEHUL COLOURS LIMITED,H3F/F14,"A305/306, Kemp Plaza, Mindspace, Malad West, Mumbai Suburban - 400064, Maharashtra, India","Mehul Joshi, Director",+91 22 28723555,+91 9820098918,info@mehulcolours.com,www.mehulcolours.com,"Leading manufacturer & exporter of Commodity & Engineering Plastics masterbatches. Range includes MB for PE, PP, ABS, SAN, PC, PET, POM, Nylon, PA6, PA66, TPU, PE, Specialty Pearl, Metallic, Fluorescent, Sparkle, Wood, PMMA, PA6, TPU, Additive MB, Antifog, FR, Slip/Antiblock, Clarifier, Impact Modifier, Purging Agent, Antimicrobial."
MERIT POLYMERS PVT LTD,H4F/D6,"Survey No.370/1(2), Kachigam, Nani Daman, Daman - 396210, Dadra And Nagar Haveli And Daman And Diu, India","Kothari, Director",+91 260 2247713,+91 9833773652,mbk@meritpolymers.com,www.meritpolymers.com,"Manufacturer of colour, black, white, filler & additive masterbatches, TPE, pigment packets, roto moulding powder in various polymer bases for different products & applications."
MERIT STRAPS AND PACKAGING INDUSTRIES,H14F/B11,"Survey No 70/P1 P3, Opp Old Pib Bus Stand, Nr Cefone Ceramic, Pipli, Morbi - 363642, Gujarat, India","Himanshu Parekh, Director",+91 2822 886566,+91 8866656658,info@meritstraps.com,www.meritstraps.com,"Leading manufacturer & exporter of PET strapping in Morbi-Gujarat serving India & globe. Largest importer & stockist of various strapping tools from Italy, Taiwan & China."
MIROTEC CORPORATION,H15/B29,"C-9/10/52-A, Old GIDC, Opposite Post Office, Valsad - 396035, Gujarat, India","Bhavesh Chheda, Partner",+91 2632 263243,+91 7016458580,mirotec95@gmail.com,www.miroglitter.com,(Manufacturer of glitter/metallic effects or related plastic products; specific details limited in text.)
MG MOULDS SYSTEMS PVT LTD,H14G/D8,"D-401, Singhad Marg, Rohan Kritika, Pune - 411030, Maharashtra, India","Prashant Padesh, Sales",+91 20 24200205,+91 9827031408,sales@mgmouldsystems.com,https://mgmouldsystems.com,"Specializes in precision mould design, advanced tooling & high-quality manufacturing solutions. Delivers reliable, customized engineering services; enhances productivity & ensures diverse industrial production requirements nationwide."
MICRO MACHINERY MANUFACTURE,H5G/C25,"Plot No. 7601, Ramol Cross Road, Phase IV, Vatva G.I.D.C., Ahmedabad - 382445, Gujarat, India","Divyesh Ganatra, Business Enhancer",+91 79 25898798,+91 7567703993,sales@micromachinery.com,www.miro-machinery.com,"Delivers advanced Plastic Recycling/Washing & PP/PET Strap Machines built on latest technology & uncompromising quality. Supports clients even years after installation; performance, reliability & trust engineered into every machine built."
MICRO POLYTECH,H1F/J37,"Plot No. 29/11/12, Village Liwaspur, Bahalgarh, Sonipat - 131029, Haryana, India","Ayush Garg, Business Partner",+91 7027504084,+91 9711148251,micropolyttech21@gmail.com,-,"Experts in vibrant colour, high-performance filler, pure white & additive masterbatches—engineered to elevate product quality & consistency."
MEAF MACHINES B.V.,H4G/G31,"Industrieweg 10, Yerseke - 4401 LB, Netherlands","Ardjan Houtemaker, Technical Director",+31 113 571495,+31 6 16216399,a.houtemaker@meaf.com,-,75+ years manufacturing equipment for plastics industry. Specialist in compact sheet extrusion lines for wide variety of applications.
MECHATRONICA S.C.,H4G/A32,"7, Rayko Daskalov Str., Gabrovo - 5300, Bulgaria","Rahul Kumar, Administrative Officer",+359 66 8138568,-,rk9207670@gmail.com,-,"Designs & builds innovative automated lines: tube making, header-capping & flexible packaging machinery—customised for cosmetics, pharmaceutical & food industries; high-speed solutions."
MEECH SHAVOTEC (MEECH INTERNATIONAL),H4G/F20,"29/2, Old Mumbai Pune Road, Kharadi, Pune - 411014, Maharashtra, India","Ravi Shinde, Sales Manager",+91 20 3382911,+91 9322105500,ravi@shavotec.in,https://www.meech.com,Offers tailored Static Control & Web Cleaning technology to remove static charges & contamination in plastics industry. Global offices; creates innovative solutions designed by industry experts.
MICROBAN INTERNATIONAL,H4G/B08,"11400 Vanstory Drive, Huntersville - 28078, North Carolina, United States","Kimberley Cherrington, Senior Global Brand Manager",+1 704 8750806,+1 959994947,kimberley.cherrington@microban.com,https://www.microban.com,"Global leader in antimicrobial product protection. Science-backed solutions guard against microbial growth, odours, chemicals, UV light & water; empowers brands across industries with trusted, built-in performance & global expertise."
MICRO-TECH MOULDS,H9/B3,"Unit No.7, Survey No.57, Gorai Pada East, Behind Hanuman Temple, Vasai East, Palghar - 401208, Maharashtra, India","Firoj Mundhe, Director",+91 250 6011136,+91 9819123510,info@microtechmould.com,www.microtechmould.com,"Global leader in manufacturing precision moulds for industries like PVC pipe fittings, caps & closures, household products. Prioritizes latest technology, innovative designs & customer satisfaction."
MIFA SYSTEMS PVT LTD,H9/A8A,"Bodakdev, Opp Rajpath Club, Ahmedabad - 380015, Gujarat, India","Joy Dsouza, Sales Head",+91 79 26871367,+91 9010616505,sales@mifasystems.com,-,Industrial Automation solutions provider.
MICROBAN INTERNATIONAL (repeated entry),H4G/B08,"11400 Vanstory Drive, Huntersville - 28078, North Carolina, United States","Kimberley Cherrington, Senior Global Brand Manager",+1 704 8750806,+1 959994947,kimberley.cherrington@microban.com,https://www.microban.com,(Duplicate entry; same as above – global antimicrobial protection solutions leader.)
