Company Name,Hall/Stall,Address / Location,Contact Person,Phone,Mobile,Email,Website,Key Profile / Products Summary
SATYANARAYAN RUBBER AND PLASTIC INDUSTRIES,H14F/D15,"Plot No. 46/2-A, Amba Estate, Behind Workwell Engineers, Near Uttam Dairy, Sukhramnagar, Ahmedabad - 380021, Gujarat, India","Snehal Shah, Partner",+91 79 22742580,+91 9821924132,info@srp.co.in,www.srp.co.in,"Leading manufacturer since 1980 of Industrial Rubber Molded and Extruded Parts, Engineering Plastic Parts, Trolley Wheels, Plastic Platform Wheels, Rubber Sheets, Metal Parts, PVC Strip Curtain, Leveling Pad, Anti Vibration Mount, Viton, Silicon rubber Parts etc."
SATYASAI MOULDS EXPORTS INDIA LLP,H14G/G15,"5/131, Marol Co-op Ind Estate, M.V. Road, Andheri East, Mumbai - 400059, Maharashtra, India","Vilas Neelkanth, Partner",+91 22 42825183,+91 9827226116,satyasaimoulds@gmail.com,www.satyasaimoulds.com,"Manufacturer of Paint, Grease, Chemical, Medicines, curd and food Blow Moulds as well as high volume industrial moulds. Injection and Blow Moulds catering to domestic and overseas countries."
SATYENDRA PACKAGING LIMITED,H5F/A5,"Privilion, Bopal Ambli Road, ISCON Opp. ISCON Temple, Ahmedabad - 380059, Gujarat, India","Nishad Oak, Senior Sales Coordinator - Exports",+91 79 48473500,+91 7777464618,sales@satyendragroup.com,www.satyendragroup.com,"One of India's fastest-growing and strong, technology-driven packaging companies with 20+ years of experience. Expertise includes PP Woven Sacks, FIBC bags, BOPP bags, paper bags, block-bottom bags, geotextiles, flexible packaging, and masterbatches. Continues to grow sustainably, aiming for industry recognition."
SCHEPERS GMBH CO KG,H5G/B03,"No. Karl Benz Straße 7, Borken, Nordrhein-Westfalen, Vreden - 46399, Germany","Ludger Boeting, Sales Manager",+49 2561 9505016,+49 162 22602647,l.boeting@schepers.de,www.schepers.de,"Manufactures precision laser direct and indirect engraving systems for embossing, printing, and anilox applications. With micron-level accuracy, delivers printing-engineered solutions. Part of Heliograph Holding Group, with 37 years since 1991 and 320+ installations."
SCHILLTEK MOULDS INDIA PVT LTD,H14G/G8,"506, Near Ramol Cross Road, Vatva GIDC, Opp. Windsor Machines, Ahmedabad - 382445, Gujarat, India","Tapan Samant, Director",+91 992 5152444,+91 7384083838,tapan@schilltek.com,www.schilltek.com,"Established in 2009, leading specialist in precision and high-quality injection moulds with over 50 years' expertise. Managed by high-entrepreneurs, delivers superior moulds for packaging, medical, electrical, and industrial applications with advanced technology and precision."
SCJ PLASTICS PVT LTD,H5F/C6,"F-3/10811, Okhla Industrial Area, Phase-1, New Delhi - 110020, Delhi, India","Rahul Jain, Managing Director",+91 11 45606777,+91 9359050500,rahul@scjgroup.com,-,"Established in 1981, leading manufacturer of colour and additive masterbatches for virtually all polymers. State-of-the-Art Laboratory Network, REACH, FDA, RoHS compliant. Manufacturing bases at Delhi, Baddi, Daman, Bangalore, Bhiwadi. Servicing leading FMCG, Auto, etc."
SELEC CONTROLS PVT. LTD.,H16/A12,"TTC Industrial Zone, 1, Mahape, Navi Mumbai, Thane - 400710, Maharashtra, India","Nilam Pillai, Business Development Manager",+91 22 41418481,+91 9939777315,brandcommunication@selec.com,-,(Profile not fully detailed in text; appears related to controls/automation or electrical components in plastics context based on name.)
SELPLAST EXPORTS PVT LTD,H11/A20,"301 Popular House, Ashram Road, Income Tax, Ahmedabad - 380009, Gujarat, India","Mauli Thakor, CSO",+91 79 26520927,+91 9903027407,joydoctor@selplast.in,-,"Delivers innovative, engineering solutions for smart manufacturing in SMED, Packaging, Cycle Time Reduction, Quality Improvement, IoT and Vision Inspection. Empowers industries with cost optimization, sustainability, and automation. 85% business from repeat global Tier-1 leaders."
SEMITRONIK INSTRUMENTS,H16/A28,"17 CD Industrial Estate, Opp. Old GIDC, Odhav, Ahmedabad - 382415, Gujarat, India","Parthav Shah, Director",+91 79 22740111,+91 9979959710,pjs@semitronik.com,-,"Manufacturer of Camera based sorting/inspection system for various plastic products (flat dripper, round dripper, PP caps etc.). Also online data monitoring system for looms. Based in Ahmedabad, Gujarat."
SERVO PLAST PACKAGING LIMITED,H7A/D19,"881/1, Cuddalore, Pondy Main Road, Manapet Post, Kattukuppam, Puducherry - 607402, Puducherry, India","Sumit Jalan, Director",+91 413 2611705,+91 9830956686,sumit@servopackaging.com,www.servopackaging.com,"Premier manufacturer of PP/HDPE woven sacks (filler/colour), PP non-woven fabric, masterbatches. Facilities in Kolkata and Puducherry. Continuous innovation and strong in-house capabilities, serving Indian and global markets effectively."
SESOTEC GMBH,H6/B7,"7HF-FP-2, Regener Str. 130, Niederbayern, Schoenberg - 94513, Bavaria, Germany","Samuel Markert, Manager Marketing Trade Fairs And Events",+49 8554 308,+49 8554308203,samuel.markert@sesotec.com,https://www.sesotec.com/de,"Advanced metal detection and recycling technologies remove secondary metal contaminants and enable production of pure, high-quality raw materials. Protects equipment and drives circular economy toward sustainable, profitable material cycles."
SEVEN STAR ENGINEERS & FABRICATORS,H7/A4,"C-1, 704 & 705, Phase - IV, GIDC, Vatva, Opp. Indo German Toolroom, Ahmedabad - 382445, Gujarat, India","Jitendra Bhatia, Managing Director",+91 79 25883145,+91 9829890221,info@sevenstarengineers.com,-,"Manufacturer of high precision Job work, Fine Pulverizer, Granulator, and all types of PVC Pipes, WPC recycling machinery. Serves industries with high-quality plastic processing solutions."
"SGO CO., LTD",H1G/E9,"10-210 Namdongseo-ro 113beon-gil, Namdong-gu, Incheon - 21695, South Korea","Jiyoung Jeong, Director",+82 32 813 3461,+82 10 74423481,info@sgoilless.co.kr,www.sgoilless.co.kr,"Powers global growth with oil-less bearings and brass solutions. Exports for 30+ years, meeting demanding technical requirements in automotive, construction, plastic injection molding, delivering innovation, reliability, and long-term customer engineering excellence."
"SHAAANXI BEIREN PRINTING MACHINERY CO., LTD.",H1F/D01,"West Dongfeng Street, Gaoxin Dist, Weinan City, Weinan - 714000, Shaanxi, China","Frank Fan, Sales Manager",+86 913 2118685,+86 13515746026,frank@beireninternational.com,-,"State-owned, biggest and best leading manufacturer of gravure, flexo printing, solvent base and solventless lamination, coating machines. Manufactures more than 4000 machines running worldwide every year."
SHAKTI PLAST CHEM PRIVATE LIMITED,H15/A12,"1 2060, DSIDC, Narela Industrial Area, Narela, New Delhi - 110040, Delhi, India","Gaurav Aggarwal, Director",+91 11 45087585,+91 9910602654,info@shaktiplastchem.com,-,"Leading polymers distributors in India. Deals in Virgin polymers like PP (Polypropylene), PE (Polyethylene) & PS (Polystyrene) and in Re-processed plastic (Homo-polymers & Co-polymers)."
SHAKTI POLYMERS,H3F/E17,"C56, Bawana, New Delhi - 110039, Delhi, India","Ayush Jindal, Proprietor",+91 11 47904760,+91 9811035511,shaktipolymersindia@gmail.com,www.shaktipolymersindia.com,(Profile not fully detailed in text; appears related to polymer manufacturing or distribution based on name and context.)
SHAKUN POLYMERS PRIVATE LIMITED,H15/B7,"50-504, Atria-2, ISKON Height, Opp. ISKON, Vadodara - 390021, Gujarat, India","Brajesh Pandey, Officer",+91 265 6196569,+91 9879401855,sales3@shakunpolymers.com,-,"Part of Shakun Polymers Private Limited, leading player in Alphagary field of compounding. With over 25 years of experience, serves wire & cable market with four major brands."
SHALIMAR EXTRUSION PVT LTD,H14G/F20,"B-4203, Kohinoor Square, N.C.Kelkar Marg, Shivaji Park, Dadar West, Mumbai - 400028, Maharashtra, India","Somdev Suhag, Manager Marketing",+91 22 2429297,+91 9827666686,shalimar.extrusion@gmail.com,-,"Leader in Manufacturing barrier-grade, high-quality products like Tarpaulins, Shade net/FIBC (Jumbo Bags), Leno Bags, etc."
SHAMS JAVAID ARVAND,H2F/E11,"No. 36, Manzarnjehad Alley, Shariati St., Above Midamad, Tehran - 1948461413, Iran","Shjazi Kazemi, Sales Expert",+98 21 22612822,+98 912 2968122,info@shjazi.com,-,"Active in production and export of polymer granules and additives like polyethylene wax, perc, plastic pallets, open top and closed top drums in different capacities."
"SHANDONG BAOFENG METALLIZER CO.,LTD.",(Not specified),"West Of Jinshun Road,Gingzhou Economic Development Zone, Qingzhou City, Weifang Province, Qingzhou - 262500, Shandong, China","Hailin Cheng, Director Manager",+86 536 2137961,+86 13614161668,sdbafeng@vip.163.com,-,"Professional manufacturer of vacuum metallizer equipment. Main products include free span metallizer, paper metallizer, induction heating metallizer, ZnS medium metallizer, magnetron sputtering metallizer."
"SHANDONG DONGLINCHEN NEW MATERIALS CO.,LTD.",H16/F65,"No.3130, Panlongshan Road, Longshan Hi-Tech Industry Zone, Linqu County, Weifang - 262600, Shandong, China","Guilin Li, Vice President",+86 536 8969020,+86 13636003225,jonson@donglinchem.com,-,"One of the leading manufacturers of PVC processing additives worldwide. Main products include impact modifiers, MBS, PVC foaming regulators, acrylic processing aids, etc. Total production capacity exceeds 200,000 MT/year."
"SHANDONG DONGXIN NEW MATERIAL TECHNOLOGY CO., LTD",H1F/F33,"28, Dongxin Road, Houzhen, Shouguang - 262700, Shandong, China","Ruiyun Yang, Manager",+86 536 5322910,+86 15853622910,4503929@qq.com,-,"High-tech enterprise established in 2005 integrating research, development, production, and trade. Main products include octabromomethyl, octabromomethyl masterbatch, TBB, TBC, tetrabromobisphenol A, MCA, etc."
"SHANDONG GTX NEW MATERIAL CO.,LTD",H1F/B15,"No.2, Qinglong Road, Yiyuan County Economic Development Zone, Zibo - 256100, Shandong, China","Alice Tsing, Sales Manager",+86 533 59617418,+86 15966617418,service@pvcadd.com,-,"Manufacturer of PVC impact modifier, PVC Stabilizer, Chlorinated Polyethylene, PVC processing additives."
SHANDONG RUIFENG CHEMICAL CO LTD,H1F/C58,"Yiyuan Economic Development Zone, Yiyuan, Zibo - 256100, Shandong, China","Sky Zhang, Sales Director",+86 533 537685,+86 13538307685,sky@ruifengchemical.com,-,"Founded in 1994, leading manufacturer of PVC processing impact modifier, MBS, CPE135A, ASA, ACR, CPETG, etc."
SHANGHAI CHEMDIO TRADING LIMITED,H16/C82,"Room 1101-1102, Building 36, 6955 Jinhai Road, Fengxian, Shanghai - 201401, China","Nikki Lin, Product Director",+86 21 37251510,+86 18917917556,nikki.lin@chemdio.com,www.chemdio.com,"Professional company focusing on export of plastic raw materials, headquartered in Shanghai, China. Three business groups: PVC, PP, PE."
"SHANGHAI COBIL CHEMICAL CO., LTD",H1F/E35,"Jovic Rd, Chuansha, Pudong, Shanghai - 201201, Shanghai, China","Jovil Lo, Overseas Marketing",+86 21 58979940,+86 13917789940,jovil@cn-cobil.com,www.cn-cobil.com,Specializes in high-performance nylon powder for various applications.
"SHANGHAI KINGFO NEW MATERIAL CO., LTD.",H1F/D35,"No. 28, Linsheng Road, Tinglin Industrial Area, Jinshan District, Shanghai - 201505, Shanghai, China","Rongsong Wang, Sales",+86 21 37919098,+86 13601608877,https://knfnonwoven.com,-,Manufacturer of new-generation high performance nonwoven lines and fabrics with over 30 years' expertise.
"ANHUI MOTECH MOULD CO., LTD.",H1F/B31,"No.1, Xinzhuang Road, North Area of Economic Development Zone, Xuancheng, Anhui - 242200, China","Guoying Hu, Marketing Director",+86 563 6613500,+86 18930344870,sales@motechmould.com,www.motechmould.com,Supplier specialized in PVC foam board lip mould. Earliest great company supply no choke-bar and movable lip mould. Great promotion and influence in PVC foam board industry.
"SHANGHAI SONNER INTELLIGENT EQUIPMENT CO., LTD.",H1G/F53,"Building 4-1, 801 Qiancang Road, Songjiang District, Shanghai - 201602, China","Tianhui Li, Marketing",+86 21 80221636,+86 18020216625,marketing@sonnerfeeder.com,www.sonnerfeeder.com,"Provides weighing and dosing systems adapted to different fiber, advanced plastic, food, and drug industries, such as compounding, chemical."
"SHANGHAI WEILEI MOULD CO., LTD",H16/E68,"Building 2, No.18, Runyang Road, Jiading District, Shanghai - 201800, Shanghai, China","Bo Qi, Manager",+86 21 314029955,+86 13140029855,wl@weileimould.cn,www.weileimould.cn,"LVT, SPC, WPC floor moulds, PVC foamed board, WPC wall panel, PVC wall panel, WPC decking, PVC profile, SPC solid board, PE/PVC co-extrusion floor and wall panel for ABA co-extrusion."
"SHANGHAI XIANGGUANG TECHNOLOGY CO., LTD.",H16/B85,"No. 420 Qiangpan Road, Waigang Town, Jiading District, Shanghai - 201806, Shanghai, China","Jinche Zhang, General Manager",+86 21 59905026,+86 150 02142888,8621 59905026@gmail.com,-,"Specialized in thermoforming and sheet extrusion over 20 years. Cost & Performance machines for your choice. Optimize production, short time profit, grow business. Only concern is spending money after use."
"SHANTOU AUTO PACKAGING MACHINERY CO., LTD.",H16/F63,"00M 101, Southeast Corner of Chenghai Road And Puning Road, Jinping, Shantou - 515031, Guangdong, China","Christy Lin, Sales",+86 754 82533292,+86 188 23990060,auto-machinery@outlook.com,www.auto-machinery.com,"Machine factory focused on thermoforming solutions, major in cup making machine, three station/four station thermoforming machine. Also owns Bagasse fiber department. Raw material can be PP, PET, PS, CPET."
"SHANTOU MINGSU MACHINERY CO., LTD",H16/A63,"Mingsu Industry Building 14, Changchun Road, Daxue Road, Jinping, Shantou - 515000, Guangdong, China","Jenny Li, Manager",+86 754 88269986,+86 180 52062176,jenny@mesoforming.com,www.mesoforming.com,"Specializes in developing, manufacturing, and selling advanced thermoforming multi-station machines for food, medical, and industrial applications."
"SHANTOU PEASHIN PACKAGING MACHINERY CO., LTD.",H16/B25,"No.65, Changrong Road, Jinping District, Shan Tou - 515061, Guangdong, China","Dongxiang Lu, Sales Manager",+86 754 33322872,+86 13433238782,sales@peashin.com,-,"Factory specializing in HDPE/LDPE Film Cutting, Inserting & Sewing & Hemming Machine Series."
SHENDE SALES CORPORATION,H14F/C3,"Dattatrya Nivas, Tilak Road, Cross Lane, 470, Sadashiv Peth, Opp. New English School, Pune - 411030, Maharashtra, India","Prashant Wani, Proprietor",+91 20 24488005,+91 9322531550,shende@salescorporation.com,www.shendesales.com,"Manufacturers of O Rings, Oil Seals & Other rubber moulded, extruded products. Specialty to cater Industry with MOQ support for new product development."
SHENZHEN MOULD-TIP INJECTION TECHNOLOGY COMPANY LIMITED,H1F/C51,"Tower 16, the Mould-Tip Industrial Park, Yulu Town, Guangming New District, Shenzhen - 518107, Guangdong Province, China","Dinesh Budanapalli, Manager",+86 755 29426727,+86 99 990492088,dinesh@mould-tip.com,-,"Founded in 1999, grown from one factory to five in China. Specializes in hot runner systems, moulds, automation across global manufacturing. Over 1,000 employees and 30+ global branches."
SHIBUARA MACHINE INDIA PRIVATE LIMITED,H5G/B3,"PB No.5, Chennai - Bangalore Highway, Chembarambakkam, Chennai - 600123, Tamil Nadu, India","Cswarmurthy B, Marketing Executive",+91 44 26812681,+91 8925188110,cswarmurthy.b@shibauramachine.co.in,-,"High-end plastic injection moulding machines and auxiliary equipment with decades of experience. Delivers energy-efficient, precision-engineered solutions, backed by Japanese technology. Exports to 45+ countries worldwide. Injection Moulding Machine, Auxiliary Equipments, Hydraulic Series, Electric Series, Automotive, Electrical, Household, Furniture, Toys, Medical, Packaging, PVC, Writing Instruments, PET, Sustainable Technology for Future."
SHIBAURA MACHINE INDIA PRIVATE LIMITED,H10/A14,"PB No.5, Chennai - Bangalore Highway, Chembarambakkam, Chennai - 600123, Tamil Nadu, India","Abhijithkumar M, Asst Manager - Marketing",+91 44 26812681,+91 9150012901,abhijithkumar.m@shibaura machine.co.in,www.shibauramachine.co.in,"Manufactures high-end plastic injection moulding machines and auxiliary equipment. With decades of experience, delivers energy-efficient, precision-engineered solutions. Backed by Japanese technology, exports to 45+ countries worldwide. Products include: Injection Moulding Machine, Auxiliary Equipments, Hydraulic Series, Electric Series, Automotive, Electrical, Household, Furniture, Toys, Medical, Packaging, PVC, Writing Instruments, PET, Sustainable Technology for Future."
SHIELD ALLOY PRODUCTS,H5G/N14,"243-A, Old Focal Point, Industrial Area, Mehta Road, Amritsar - 143001, Punjab, India","Nipun Aggarwal, Partner",+91 98104 54160,+91 9810405460,shieldalloy@gmail.com,www.shieldknives.com,"Established since 2015, leading manufacturer and exporter of knives & Blades for Wood industry, Paper & Printing industry, and also largest exporters to American and European countries."
SHINE AND GLOW GROUP,(Not specified),"Hotel The Basil Park, SA, Opp. Victoria Park, ISCON Mega City, Bhavnagar - 364002, Gujarat, India","Chinmay Shah, CEO & Founder",+91 982 4345050,+91 8469050800,chinmay@shineandglowgroup.com,www.shineandglowgroup.com,"Importers, Stockiest, Wholesaler of Plastic Grinds/Scrap/Granules, specializing in both engineering and non-engineering plastics. Operational sourcing offices in Gandhidham, India, and facilities in Japan, South Korea."
SHINI PLASTICS TECHNOLOGIES INDIA PVT LTD,H16/B8,"A-46, Chakan Industrial Area, Phase II, MIDC, Taluka Khed, Pune - 410501, Maharashtra, India","Saiprakash Jadhav, Marketing & Sales Department",+91 2135 3560,+91 9590940748,marketing@shiniindia.com,www.shiniindia.com,"Delivers precision-engineered auxiliary and automation manufacturing equipment backed by global expertise: robots, MD chillers, dryers, grinders, Material Loading systems for consistent quality, energy efficiency, and optimized production for modern plastics processors."
SHINKO NAMEPLATE INDIA PRIVATE LIMITED,H14G/G7,"Room No. 211, Tejas Arcade, Ward No.9, 1st Main Road, Rajajinagar, Bengaluru - 560010, Karnataka, India","Darunee Plangsri, Assistant Manager",+91 80 68136300,+66 8991182297,darunee@shinko-nameplate.co.th,www.shinko-nameplate.co.jp,"Subsidiary of Shinko Nameplate Co., Ltd. (established 1947), specializes in decorative sales office supporting plastic automotive industry leading worldwide."
SHINKONG SYNTHETIC FIBERS CORPORATION,H2F/C5,"Lotus Building, Ren Ai Road, Sec. 3, No. 136, Da An District, Taipei City - 10657, Taiwan","Chih Hsu, Marketing Chief",+886 2 25071259,+886 988292596,chih.hsu@ssf.com.tw,-,"Founded in 1967 by Chairman H.S.K. Wu and partners. Main product categories include polyester (PET/PTT/PEE) pellets, PET bottle preforms, engineering plastic, etc."
SHITAL INDUSTRIES PVT LTD,H4F/C9,"Shital House, B/H ONGC Workshop, Sabarmati, Ahmedabad - 380005, Gujarat, India","Vivek Patel, Director",+91 79 27588388,+91 9897583888,vivek@shitalind.com,www.shitalind.com,"India's largest manufacturer and exporter of Antimony Stabilizers, Liquid Mixed Metal 3-Star Stabilizers, ESBO, and more. Renowned worldwide for unmatched quality, reliability, innovation, and service excellence."
SHIV ENTERPRISE (ROYAL PLAST),H14F/F9,"Shed No. 151, Pushp Industrial Park, Nr. Patel Mill, Raipur Mill Compound, Rakhial, Ahmedabad - 380023, Gujarat, India","Vinod Bhambri, Partner",+91 99 13361970,+91 9913361970,royalshiventrerprise.com,https://royalshiventrerprise.com,"Leading producer of high-quality plastic kitchenware products, driven by innovation, world-class standards, and continuous improvement. Since 1999, delivered value to customers nationwide through reliable products, strong R&D, and commitment to excellence."
SHIV PLASTICS,H15/C6,"56A/2, Rama Road, Najafgarh Road Indl Area, New Delhi - 110015, Delhi, India","Mukesh Chandra, Proprietor",+91 11 41332167,+91 9810303084,mukeshchandra5@yahoo.com,-,Manufacturers of Reprocessed Engineering Polymers Black & White since 1985. Manufacture all ABS Grades (Precolored Natural Black White) and deal in all Engineering Polymer Grades.
SHIVAM MECHOL,H5G/B27,"E-42, Survey No 337/18, Plot No. 18, J.K. Industrial Park, Near Himalaya Polyurethane, Velpura, Pardi - Valsad - 396125, Gujarat, India","Manish Shivam, Proprietor",-,+91 9971555390,admin@shivamechol.com,-,"Delivers pelletizing plants, polymer filtration systems for polyester, BOPP & BOPET film lines, and plastics recycling industries. Expertise in design, fabrication, automation, customized engineering solutions worldwide."
SHIVA POLYMERS,H1F/H7,"E- Sector 5, Bawana Industrial Area, New Delhi - 110039, Delhi, India","Shivam Aggarwal, Proprietor",+91 11 44471141,+91 9899654314,shivam3613@gmail.com,www.shivaopolymers.com,Plastic waste recycling company based out of New Delhi.
SHIVAM MACHINERY,H5G/C21,"A 250 Ground Floor, Ashok Vihar Phase IV, Traditional Delhi, New Delhi - 110052, Delhi, India","Santosh Kumar, PRO",-,+91 8700696202,shivam_machinery2012@yahoo.co.in,-,"Deals in Extruder Machine, Sealing Machine, Bag Cutting Machine."
SHIVAM POLYMERS,(Not specified),"Plot No. 257,258, Pocket-C, Sector-3, DSIDC Bawana Industrial Area, New Delhi - 110039, Delhi, India","Ram Kishan Garg, Proprietor",+91 11 41412422,+91 9818803399,shivampolymers2010@gmail.com,-,"With 36 years of excellence, leading manufacturer, trader, importer, and exporter of premium PP, CP, BOPP, ABS, TPR, TPE Compounds Granules in various colours for air coolers, chairs, toys, and diverse home appliances."
SHIVTEK SPECHEM INDUSTRIES LTD,H5G/D5,"1419, 14th Floor, DLF Corporate Green, SPR Road, Sector 74A, Tower 1, Gurgaon - 122004, Haryana, India","Amit Nemani, Managing Director",+91 124 6940448,+91 9999885402,amit@shiva-group.com,-,"Leading manufacturer of high-performance specialty chemicals, specialty plasticizers, and oil additives, with plants in Dahej, Karnal, and Rajpura. Exports to 75+ countries, serving pharma, agrochemical, textile, and industrial sectors globally."
SHREE GANESH INDUSTRIES,H5G/C19,"WZ-508/6, Tanwar Marg, Basai Dara Pur, Nr Govt School, New Delhi/6 - 110015, Delhi, India","Raj Industries1, Proprietor",+91 11 44444121,+91 9217161815,sgi.industries1@gmail.com,-,Manufacture of Parts of Blown Film Industries.
SMP MEENAKSHI POLYMERS,H14F/E15,"Unit No. 4/27, Site - II, (Ajanta), UPSIDC, Loni Road, Mohan Nagar, Hindon Air Force Gate, Ghaziabad - 201007, Uttar Pradesh, India","K.N. Pandey, VP",+91 11 9811430378,+91 9811430378,shreemeena26@yahoo.co.in,-,"Manufacturers of Engineering Plastics such as Cast Nylon 6/PA6, Oil on Green/GSM/MC/POM(Delrin)/PP/HDPE/Nylon/PU & Moulded Components in Stock Shape Sheet/Rod/Square/As per Drg of Customer. Also Metal Components as per Drg of Customer."
SHREE NATHJI DYESTUFFS,H12F/T8,"B-70/71, Lawrence Road Industrial Area, New Delhi - 110035, Delhi, India","Jatin Kumar Behl, Proprietor",+91 11 43595895,+91 9811167305,jatin@shreenathji.net,www.shreenathji.net,"Manufacture phthalate-free, non-bleeding, non-toxic pigment dispersions for liquid PVC, non-plasticized, silicone rubber, silicone oil utensils, etc. Also manufacture water-based, solvent-based liquid pigment dispersion. In-house well-equipped lab for quality control and assurance."
SHREEPOLYMER,H3F/D5,"A-167, Narela, New Delhi - 110040, Delhi, India","Vrun Gupta, Managing Director",+91 11 4444751,+91 9811442751,md@shreepolymer.org,-,"Manufacture fresh and reprocessed plastic granules in Delhi. With years of experience, our reprocessing unit ensures consistent quality and reliability, serving diverse industries with high-grade plastic materials for manufacturing and production needs."
SHREE RADHIKA PLAST LLP,H3F/D12,"Plot No.916, M.I.E. Part-A, Bahadurgarh, Jhajjar - 124507, Haryana, India","Vineet Kataria, Partner",-,+91 8810858964,info@shreeradhi kaplastllp.com,-,"Leading innovation in PC/ABS, Manufacturer & Compounders of Value Added Granules in PC/ABS, PC/ABS Alloy Melamine/Urea Formaldehyde Molding Powder. Promoting Quality & Sustainable Future by Certification & Standardization."
SHREE RAM POLYTECH,H14F/F5,"Shee Ram Polytech, Dumiyani, Rajkot - 360004, Gujarat, India","Ravi Kalavadiya, MD",+91 81411 77888,+91 9825078805,sheeerampolytech@gmail.com,-,"Manufacturer of UPVC Pipes & Fittings, PVC Pipe & Fittings. Manufacturing 550 Ton Pipe & fittings per month. Brand name poly-teck."
SHREE RAMA MULTITECH LTD,H14F/E19,"1557, Moti Bhoyan, Kalol, Gandhinagar - 382721, Gujarat, India","Vineet Agarwal, Manager",+91 79 66747101,+91 9979824721,vineet@srmtl.com,www.srmtl.com,"Tube Laminate & Lami-Tube manufacturer with technical expertise of more than 3 decades. Pioneer in industry. Producing customized Laminate etc. One stop solution for ABL, PBL packaging requirements."
SHREE UMIYA AGGLOMERATES,H15/C11,"Plot No C/1776, Chitra GIDC, Near Bhagwati Sabu, Bhavnagar - 364060, Gujarat, India","Tarak Patel, Managing Director",+91 95 74216886,+91 9879509090,umiyaagglo@gmail.com,-,"Manufacturer and exporter of LDPE compounds, LDPE Foam Powder and Copper Antimicrobial materials. Antimicrobial materials suitable for rotational moulding, blow moulding, injection moulding, and extrusion. Supply them as ready-to-use powders, masterbatches, and additives."
SHREE VARNIKA TECHNO PACK PVT LTD,H14F/E26,"Sy No 442/442AA, Sultanpur Village, Ameenpur Mandal, Yellareddy - 502319, Telangana, India","Ranjit Agarwal, Director",+91 7330 654977,+91 9502119891,accounts@svtp.co.in,www.svtp.co.in,"Manufactures high-quality IML packaging for India's leading injection-moulding technology. Delivers durable, visually striking containers for dairy, confectionery, and household products with consistent quality and customised solutions."
